triple,truth
athlete jakeplummer athleteplaysforteam sportsteam broncos,1
personmexico mannyramirez athleteplaysforteam sportsteam dodgers,0
athlete shaq athleteplaysforteam sportsteam suns,0
personmexico chrissampson athleteplaysinleague sportsleague mlb,0
athlete joemays athleteplaysinleague sportsleague mlb,1
personmexico iansnell athleteplaysinleague sportsleague mlb,1
athlete arthurrhodes athleteplayssport sport baseball,1
athlete melvinmora athleteplaysinleague sportsleague mlb,1
personmexico codyross athleteplaysforteam sportsteam marlins,1
sportsteam oaklandathletics teamhomestadium stadiumoreventvenue mcafeecoliseum,1
athlete philsimms athleteledsportsteam sportsteam newyorkgiants,1
athlete mattmurton athleteplaysinleague sportsleague mlb,1
athlete ronnycedeno athleteplaysinleague sportsleague mlb,1
personmexico joshwillingham athleteledsportsteam sportsteam marlins,1
athlete markanderson athleteledsportsteam sportsteam newenglandpatriots,0
coach kevinkouzmanoff athleteplayssport sport baseball,1
personmexico raulvaldes athleteplaysinleague sportsleague mlb,1
personmexico johnnydamon athleteplayssport sport baseball,1
personmexico jasonschmidt athleteplayssport sport baseball,1
coach bradthompson athleteledsportsteam sportsteam packers,0
athlete michaelredd athleteledsportsteam sportsteam bucks,1
athlete johnwetteland athleteplayssport sport baseball,1
athlete garysheffield athleteledsportsteam sportsteam newyorkyankees,1
athlete nickswisher athleteplayssport sport baseball,1
personmexico josevalverde athleteplayssport sport baseball,1
athlete tanyonsturtze athleteplayssport sport baseball,1
coach greggpopovich worksfor sportsteam sanantonio,1
sportsteam virginiatechhokies teamhomestadium stadiumoreventvenue lanestadium,1
athlete jasonmichaels athleteplayssport sport baseball,1
athlete chanhopark athleteplaysinleague sportsleague mlb,1
personasia brettgardner athleteledsportsteam sportsteam chicagocubs,1
personmexico joshwillingham athleteplaysinleague sportsleague mlb,1
athlete markteixeira athleteplayssport sport baseball,1
athlete barrybonds coachesteam sportsteam sanfranciscogiants,0
athlete rogerclemens athleteplaysinleague sportsleague mlb,1
athlete andysonnanstine athleteplaysinleague sportsleague mlb,1
athlete jasoncampbell athleteledsportsteam sportsteam redskins,1
athlete chrissmith athleteplaysinleague sportsleague mlb,1
athlete joebeimel athleteplaysinleague sportsleague mlb,1
athlete ryanbraun athleteplaysinleague sportsleague mlb,1
athlete guillermodiaz athleteplaysforteam sportsteam knicks,0
sportsteam steelers teamplaysinleague sportsleague nfl,1
personmexico jaybruce athleteplaysinleague sportsleague mlb,1
athlete ronnyturiaf athleteledsportsteam sportsteam losangeleslakers,1
athlete davidwells athleteplayssport sport baseball,1
athlete seanburnett athleteplaysinleague sportsleague mlb,1
athlete yorvittorrealba athleteplayssport sport baseball,1
athlete nickyoung athleteplaysforteam sportsteam washingtonwizards,0
sportsteam cavaliers teamhomestadium stadiumoreventvenue quickenloansarena,1
athlete shawnestes athleteplaysinleague sportsleague mlb,1
athlete mattmorris athleteplayssport sport baseball,1
coach jefffulchino athleteplaysinleague sportsleague mlb,1
athlete courtneyfells athleteplaysforteam sportsteam wolfpack,1
sportsteam rams teamplaysinleague sportsleague nfl,1
athlete pedroia athleteplaysforteam sportsteam redsox,1
athlete ichirosuzuki athleteledsportsteam sportsteam seattlemariners,1
athlete hakimwarrick athleteplaysforteam sportsteam reds,0
personmexico jeffmathis athleteplaysinleague sportsleague mlb,1
athlete randyjohnson athleteplayssport sport baseball,1
personmexico jasonbay coachesteam sportsteam pirates,0
coach kameronloe athleteplayssport sport baseball,1
personmexico ryanchurch athleteledsportsteam sportsteam newyorkmets,1
athlete jasonvaritek athleteplaysinleague sportsleague mlb,1
personmexico jaybruce athleteplaysforteam sportsteam reds,1
coach richardjefferson coachesteam sportsteam nets,0
athlete chaddurbin athleteplayssport sport baseball,1
athlete roycering athleteplaysinleague sportsleague mlb,1
athlete bradlidge athleteplayssport sport baseball,1
male yogiberra athleteplaysinleague sportsleague mlb,1
athlete marcbulger athleteledsportsteam sportsteam rams,1
athlete carlcrawford athleteplaysinleague sportsleague mlb,1
sport baseball sportusesstadium stadiumoreventvenue wrigleyfield,1
athlete baldelli athleteplaysinleague sportsleague mlb,1
athlete seancasey athleteplaysinleague sportsleague mlb,0
athlete philrizzuto athleteplaysinleague sportsleague mlb,0
personmexico dennisrodman athleteplayssport sport baseball,0
sportsleague nba leaguestadiums stadiumoreventvenue energysolutionsarena,1
athlete clifffloyd athleteplaysinleague sportsleague mlb,1
athlete joenamath athleteplaysforteam sportsteam newyorkjets,1
personmexico mannyramirez athleteledsportsteam sportsteam dodgers,1
personmexico shanevictorino athleteplaysinleague sportsleague mlb,1
sportsleague mlb leaguestadiums stadiumoreventvenue minutemaidpark,1
athlete gregoden athleteplaysforteam sportsteam suns,0
athlete mikejacobs athleteplaysinleague sportsleague mlb,1
coach chrisvolstad athleteplaysinleague sportsleague mlb,1
athlete brettfarve athleteplaysforteam sportsteam packers,1
personmexico mattkemp athleteplaysforteam sportsteam dodgers,1
sportsteam twins teamplaysinleague sportsleague mlb,1
athlete chaseutley athleteplaysforteam sportsteam magic,1
athlete jasonvaritek athleteplayssport sport baseball,1
athlete mattgarza athleteplaysinleague sportsleague mlb,1
athlete johnsalmons athleteledsportsteam sportsteam kings,1
sportsleague ncaa leaguestadiums stadiumoreventvenue jacktricestadium,1
coach scottproctor athleteplayssport sport baseball,1
athlete micahowings athleteplayssport sport baseball,1
sportsteam bostonbruins teamhomestadium stadiumoreventvenue tdbanknorthgarden,1
sportsleague mlb leaguestadiums stadiumoreventvenue historicfenwaypark,1
athlete davidcone athleteplaysinleague sportsleague mlb,1
athlete hirokikuroda athleteplaysinleague sportsleague mlb,1
athlete jalenrose athleteplayssport sport baseball,0
athlete davidjustice athleteplaysinleague sportsleague mlb,1
sportsteam rockets teamhomestadium stadiumoreventvenue toyotacenter,1
personmexico markmcgwire athleteledsportsteam sportsteam louiscardinals,1
athlete tanyonsturtze athleteplaysinleague sportsleague mlb,1
personmexico lukescott athleteplayssport sport baseball,1
athlete albertpujols athleteplayssport sport baseball,1
athlete johnnycueto athleteplayssport sport baseball,1
athlete tracymcgrady athleteledsportsteam sportsteam rockets,1
athlete mattholliday athleteplaysinleague sportsleague mlb,1
athlete gregorblanco athleteplayssport sport baseball,1
athlete jamariomoon athleteplaysforteam sportsteam raptors,0
personmexico oliverperez athleteplaysinleague sportsleague mlb,1
athlete danfouts athleteledsportsteam sportsteam sandiegochargers,1
sportsteam minnesotatimberwolves teamhomestadium stadiumoreventvenue targetcenter,1
athlete chanhopark athleteplayssport sport baseball,1
athlete jonathanvilma athleteledsportsteam sportsteam neworleanssaints,1
coach rickieweeks athleteplayssport sport baseball,1
personmexico alexrodriguez athleteledsportsteam sportsteam newyorkyankees,1
personmexico jimjackson athleteplaysforteam sportsteam knicks,1
athlete dustinackley athleteplaysinleague sportsleague mlb,1
sportsleague mlb leaguestadiums stadiumoreventvenue metrodome,1
coach josearredondo athleteplaysinleague sportsleague mlb,1
athlete keithhernandez athleteplayssport sport baseball,1
athlete brianmoehler athleteplayssport sport baseball,1
athlete davidprice athleteplayssport sport baseball,1
sportsteam sandiegochargers teamhomestadium stadiumoreventvenue petcopark,1
athlete giambi coachesteam sportsteam newyorkyankees,1
personmexico codyross athleteplaysinleague sportsleague mlb,1
personmexico danuggla athleteplaysinleague sportsleague mlb,1
personmexico codyross athleteplayssport sport baseball,1
coach mikefontenot athleteplaysinleague sportsleague mlb,1
coach johnbuck athleteplayssport sport baseball,1
athlete carlospena athleteplayssport sport baseball,1
sportsleague nfl leaguestadiums stadiumoreventvenue lpfield,1
athlete reggienelson athleteledsportsteam sportsteam magic,0
athlete carsonpalmer athleteledsportsteam sportsteam bengals,1
athlete edgarmartinez athleteplayssport sport baseball,1
athlete jonathanvilma athleteplaysforteam sportsteam neworleanssaints,1
athlete jonathanpapelbon athleteplayssport sport baseball,1
personmexico jorgecantu athleteplayssport sport baseball,1
athlete udonishaslem athleteplaysforteam sportsteam heat,1
athlete kirbypuckett athleteplaysforteam sportsteam twins,1
athlete pejastojakovic athleteledsportsteam sportsteam sacramentostatehornets,0
athlete luisayala athleteplayssport sport baseball,1
sportsleague nhl leaguestadiums stadiumoreventvenue aircanadacenter,1
sportsteam atlantabraves teamhomestadium stadiumoreventvenue turnerfield,1
personmexico joelzumaya athleteplaysinleague sportsleague mlb,1
athlete claudiovargas athleteplayssport sport baseball,1
athlete troytulowitzki athleteplayssport sport baseball,1
coach markhendrickson athleteplayssport sport baseball,1
athlete kevincash athleteplaysinleague sportsleague mlb,1
athlete harmonkillebrew athleteplaysinleague sportsleague mlb,1
sportsteam newyorkmets teamplaysinleague sportsleague mlb,1
athlete mikejacobs athleteplayssport sport baseball,1
athlete jacquejones athleteplayssport sport baseball,1
athlete fernandoabad coachesteam sportsteam newyorkmets,0
personasia rickankiel athleteledsportsteam sportsteam louiscardinals,0
athlete jairjurrjens athleteplaysinleague sportsleague mlb,1
athlete joshjohnson athleteplayssport sport baseball,1
sportsteam philadelphiaphillies teamhomestadium stadiumoreventvenue citizenbankpark,1
athlete ronnyturiaf athleteplaysforteam sportsteam losangeleslakers,1
athlete billmazeroski athleteplaysinleague sportsleague mlb,1
athlete jeffkarstens athleteplayssport sport baseball,1
athlete uguethurbina athleteplayssport sport baseball,1
athlete chrisbritton athleteplayssport sport baseball,1
athlete carlcrawford athleteplayssport sport baseball,1
sportsteam bills teamhomestadium stadiumoreventvenue ralphwilsonstadium,1
athlete tywigginton athleteplaysforteam sportsteam houstonastros,0
coach jjhardy athleteplayssport sport baseball,1
sportsteam n1985chicagobears teamplaysinleague sportsleague nfl,1
athlete rickynolasco athleteplaysinleague sportsleague mlb,1
sportsteam portlandtrailblazers teamhomestadium stadiumoreventvenue rosegardenarena,1
athlete williestargell athleteplayssport sport baseball,1
personmexico josecontreras athleteplayssport sport baseball,1
coach jjhardy athleteplaysinleague sportsleague mlb,1
sportsteam reds teamplaysinleague sportsleague mlb,1
athlete daisukematsuzaka athleteplaysinleague sportsleague mlb,1
personmexico iansnell athleteplayssport sport baseball,1
athlete bradbutler athleteledsportsteam sportsteam charlottebobcats,0
athlete jasonvargas athleteplaysinleague sportsleague mlb,1
personmexico jasonmarquis athleteplaysinleague sportsleague mlb,1
athlete jasonvargas athleteplayssport sport baseball,1
athlete joemauer athleteplayssport sport baseball,1
personasia brettgardner athleteplayssport sport baseball,1
athlete jefffrancoeur athleteplaysforteam sportsteam atlantabraves,1
athlete shawnestes athleteplayssport sport baseball,1
athlete senecawallace athleteplaysforteam sportsteam seahawks,1
athlete damioneasley athleteplaysinleague sportsleague mlb,1
athlete natemclouth athleteplaysinleague sportsleague mlb,1
athlete trentgreen athleteplaysforteam sportsteam rams,1
athlete randywolf athleteplayssport sport baseball,1
sportsteam leafs teamplaysinleague sportsleague nhl,1
athlete ryanfreel athleteplaysinleague sportsleague mlb,1
personmexico jasonfrasor athleteplaysinleague sportsleague mlb,1
sportsleague nba leaguestadiums stadiumoreventvenue americanairlinesarena,1
athlete matttreanor athleteplaysinleague sportsleague mlb,1
personmexico jorgesosa athleteplaysinleague sportsleague mlb,1
athlete ramonhernandez athleteplaysinleague sportsleague mlb,1
sportsteam diamondbacks teamplaysinleague sportsleague mlb,1
personmexico brianfuentes athleteplaysinleague sportsleague mlb,1
athlete marcbulger athleteplaysforteam sportsteam rams,1
athlete albertpujols athleteplaysinleague sportsleague mlb,1
athlete billmueller athleteplaysinleague sportsleague mlb,1
male alexrios athleteplaysforteam sportsteam bluejays,1
personmexico alfredoamezaga athleteplayssport sport baseball,1
personmexico markloretta athleteplayssport sport baseball,1
personmexico brianfuentes athleteplayssport sport baseball,1
personmexico jasonkubel athleteplayssport sport baseball,1
athlete brettfarve athleteledsportsteam sportsteam packers,1
athlete craigbiggio athleteplaysinleague sportsleague mlb,1
athlete yunieskybetancourt athleteplaysinleague sportsleague mlb,1
athlete ryanfreel athleteledsportsteam sportsteam reds,1
sportsteam clippers teamhomestadium stadiumoreventvenue staplescenter,1
athlete mattholliday athleteplaysforteam sportsteam coloradorockies,1
athlete mikecameron athleteplayssport sport baseball,1
athlete mikecameron athleteledsportsteam sportsteam brewers,1
athlete lennydykstra athleteplaysinleague sportsleague mlb,1
athlete octaviodotel athleteplayssport sport baseball,1
athlete georgesherrill athleteplayssport sport baseball,1
personus kobebryant athleteledsportsteam sportsteam losangeleslakers,1
athlete scottlinebrink athleteplaysinleague sportsleague mlb,1
athlete claybuchholz athleteplayssport sport baseball,1
athlete caseyblake athleteplaysinleague sportsleague mlb,1
athlete mikelowell athleteplayssport sport baseball,1
athlete wilsonchandler athleteplaysforteam sportsteam knicks,1
personmexico carlpavano athleteplaysinleague sportsleague mlb,1
personmexico michaelbourn athleteledsportsteam sportsteam houstonastros,0
coach scottschoeneweis athleteplayssport sport baseball,1
athlete blakedewitt athleteplayssport sport baseball,1
sportsleague nfl leaguestadiums stadiumoreventvenue ralphwilsonstadium,1
sportsteam atlantahawks teamhomestadium stadiumoreventvenue philipsarena,1
athlete andreabargnani athleteledsportsteam sportsteam raptors,1
athlete evanlongoria athleteplayssport sport baseball,1
athlete charliebatch athleteledsportsteam sportsteam steelers,1
athlete jamiemoyer athleteplaysinleague sportsleague mlb,1
coach paulbyrd athleteplayssport sport baseball,1
athlete rafaelsoriano athleteplaysinleague sportsleague mlb,1
athlete josereyes athleteplaysinleague sportsleague mlb,1
athlete akinoriiwamura athleteplaysforteam sportsteam tampabaydevilrays,1
athlete berniewilliams athleteledsportsteam sportsteam newyorkyankees,1
athlete brianmoehler athleteplaysinleague sportsleague mlb,1
sportsteam mavericks teamhomestadium stadiumoreventvenue americanairlinescenter,1
athlete shinsoochoo athleteplayssport sport baseball,1
athlete cococrisp athleteplaysforteam sportsteam redsox,1
athlete jedlowrie athleteplaysinleague sportsleague mlb,1
athlete markreynolds athleteplaysinleague sportsleague mlb,1
athlete shelleyduncan athleteplayssport sport baseball,1
personmexico michaelbourn athleteplayssport sport baseball,1
athlete mikeschmidt athleteplayssport sport baseball,1
athlete chuckjames athleteplaysinleague sportsleague mlb,1
personmexico freddysanchez athleteplaysinleague sportsleague mlb,1
coach markkotsay athleteplaysinleague sportsleague mlb,1
athlete ryantheriot athleteplayssport sport baseball,1
athlete koyiehill athleteplaysinleague sportsleague mlb,1
coach sethsmith athleteplayssport sport baseball,1
personmexico mattdiaz athleteplaysinleague sportsleague mlb,1
sportsleague nfl leaguestadiums stadiumoreventvenue mcafeecoliseum,1
male dye athleteplaysforteam sportsteam redsox,0
athlete rickvandenhurk athleteplaysinleague sportsleague mlb,1
sportsleague mlb leaguestadiums stadiumoreventvenue comerica,1
personmexico daviddejesus athleteplaysinleague sportsleague mlb,1
athlete kipwells athleteplaysinleague sportsleague mlb,1
athlete joshhamilton athleteplaysinleague sportsleague mlb,1
coach mikefontenot athleteplayssport sport baseball,1
athlete jimrice athleteplaysinleague sportsleague mlb,1
sportsteam philadelphia76ers teamplaysinleague sportsleague nba,1
athlete freddiejones athleteplaysforteam sportsteam losangeleslakers,1
athlete ericgordon athleteplaysforteam sportsteam clippers,0
athlete davidprice athleteplaysinleague sportsleague mlb,1
personmexico alexrodriguez athleteplaysforteam sportsteam newyorkyankees,1
personmexico jasonmarquis athleteplayssport sport baseball,1
sportsteam oaklandathletics teamplaysinleague sportsleague mlb,1
athlete woodywilliams athleteplayssport sport baseball,1
athlete markgrace athleteplaysinleague sportsleague mlb,1
athlete fabriciooberto athleteplaysforteam sportsteam sanantonio,1
personmexico lukehudson athleteplayssport sport baseball,1
sportsteam iowastate teamhomestadium stadiumoreventvenue jacktricestadium,1
athlete georgebrett athleteplayssport sport baseball,1
athlete timhudson athleteplaysinleague sportsleague mlb,1
personmexico alexicasilla athleteplayssport sport baseball,1
athlete jobachamberlain athleteplaysinleague sportsleague mlb,1
athlete walterpayton athleteledsportsteam sportsteam broncos,0
athlete philnevin athleteplayssport sport baseball,1
athlete jasonkendall athleteplayssport sport baseball,1
athlete jackierobinson athleteplaysforteam sportsteam brooklyndodgers,1
athlete miltonbradley athleteplaysinleague sportsleague mlb,1
athlete felixpie athleteledsportsteam sportsteam chicagocubs,1
athlete chipperjones athleteplaysforteam sportsteam atlantabraves,1
athlete petermoylan athleteplaysinleague sportsleague mlb,1
sportsteam newyorkgiants teamhomestadium stadiumoreventvenue giantsstadium,1
personmexico jaygibbons athleteledsportsteam sportsteam orioles,1
athlete rickeyhenderson athleteplayssport sport baseball,1
athlete bartstarr athleteplaysforteam sportsteam packers,1
personmexico nickpunto athleteplaysforteam sportsteam twins,1
athlete jimkelly athleteplaysforteam sportsteam bills,1
athlete jeffkent athleteplayssport sport baseball,1
personmexico brianmccann athleteplaysinleague sportsleague mlb,1
coach joeborowski athleteplayssport sport baseball,1
athlete jasonkendall athleteplaysinleague sportsleague mlb,1
athlete takashisaito athleteplaysinleague sportsleague mlb,1
athlete kellyjohnson athleteledsportsteam sportsteam atlantabraves,1
sportsteam losangelesclippers teamhomestadium stadiumoreventvenue staplescenter,1
personmexico markteahen athleteplaysinleague sportsleague mlb,1
sportsteam memphisgrizzlies teamplaysinleague sportsleague nba,1
sportsteam auburntigers teamhomestadium stadiumoreventvenue jordanharestadium,1
athlete xaviernady athleteplaysforteam sportsteam newyorkyankees,0
sport baseball sportusesstadium stadiumoreventvenue targetfield,1
athlete samcassell athleteplaysforteam sportsteam bostonceltics,1
athlete chadbradford athleteplayssport sport baseball,1
athlete jacquejones athleteplaysinleague sportsleague mlb,1
personmexico joeygathright athleteplaysinleague sportsleague mlb,1
athlete alcidesescobar athleteplaysinleague sportsleague mlb,1
personmexico adamloewen athleteplaysinleague sportsleague mlb,1
athlete mattgarza athleteplayssport sport baseball,1
sportsleague nfl leaguestadiums stadiumoreventvenue paulbrownstadium,1
athlete alexeiramirez athleteplaysinleague sportsleague mlb,1
athlete ajpierzynski athleteplaysinleague sportsleague mlb,1
athlete jamesloney athleteplayssport sport baseball,1
athlete chrislambert athleteplayssport sport baseball,1
athlete alexeiramirez athleteplayssport sport baseball,1
coach josejuanbarea athletehomestadium stadiumoreventvenue quickenloansarena,1
athlete chadpennington athleteplaysforteam sportsteam newyorkjets,0
athlete robbiefowler athleteplaysforteam sportsteam liverpool,1
sportsteam buccaneers teamhomestadium stadiumoreventvenue stpetetimesforum,1
athlete nealcotts athleteplaysinleague sportsleague mlb,1
athlete jeremyhermida athleteplayssport sport baseball,1
sportsteam arizonadiamondbacks teamhomestadium stadiumoreventvenue chasefield,1
sportsteam royals teamhomestadium stadiumoreventvenue kauffmanstadium,1
athlete shaunlivingston athleteplaysforteam sportsteam clippers,1
coach josejuanbarea coachesteam sportsteam cavaliers,1
athlete kelennaazubuike athleteledsportsteam sportsteam goldenstatewarriors,1
athlete carlcrawford athleteledsportsteam sportsteam tampabaydevilrays,0
sportsleague nba leaguestadiums stadiumoreventvenue madisonsquaregarden,1
athlete homerbailey athleteplaysinleague sportsleague mlb,1
athlete philcoke athleteplayssport sport baseball,1
athlete elimanning athleteledsportsteam sportsteam newyorkgiants,1
sportsleague mlb leaguestadiums stadiumoreventvenue wrigleyfield,1
athlete chaseutley athleteledsportsteam sportsteam magic,1
athlete stevegarvey athleteplayssport sport baseball,1
athlete gradysizemore athleteplayssport sport baseball,1
athlete rickynolasco athleteplayssport sport baseball,1
athlete markbuehrle athleteplayssport sport baseball,1
athlete honuswagner athleteplayssport sport baseball,1
athlete shinsoochoo athleteplaysinleague sportsleague mlb,1
personmexico melkycabrera athleteplaysinleague sportsleague mlb,1
coach jeffsamardzija athleteplaysinleague sportsleague mlb,1
personaustralia davidpauley athleteplaysinleague sportsleague mlb,1
athlete jeffnelson athleteplaysinleague sportsleague mlb,1
athlete ryanbraun athleteledsportsteam sportsteam brewers,1
athlete jaredreiner athleteplaysforteam sportsteam losangeleslakers,1
coach markkotsay athleteplayssport sport baseball,1
sportsteam pittsburghpenguins teamplaysinleague sportsleague nhl,1
athlete bradradke athleteplayssport sport baseball,1
sportsteam redskins teamhomestadium stadiumoreventvenue fedexfield,1
sportsleague mlb leaguestadiums stadiumoreventvenue chasefield,1
athlete mikegonzalez athleteplaysinleague sportsleague mlb,1
athlete jparencibia athleteplaysforteam sportsteam bills,1
athlete mehmetokur athleteledsportsteam sportsteam jazz,1
sportsteam portlandtrailblazers teamhomestadium stadiumoreventvenue rosegardenarena,1
athlete rafaelfurcal athleteplaysinleague sportsleague mlb,1
sportsteam sanfrancisco49ers teamhomestadium stadiumoreventvenue candlestickpark,0
athlete hankaaron athleteplayssport sport baseball,1
athlete russellbranyan athleteplayssport sport baseball,1
athlete darrellrasner athleteplaysinleague sportsleague mlb,1
sportsteam stlouiscardinals teamplaysinleague sportsleague mlb,1
athlete akinoriiwamura athleteplayssport sport baseball,1
personmexico brianmccann athleteplayssport sport baseball,1
sportsteam philadelphia76ers teamhomestadium stadiumoreventvenue wachoviacenter,1
athlete chrischambliss athleteplayssport sport baseball,1
sportsleague mlb leaguestadiums stadiumoreventvenue safecofield,1
sportsteam chicagobulls teamplaysinleague sportsleague nba,1
athlete brettfavre athleteledsportsteam sportsteam newyorkjets,0
athlete andrebarrett athleteplaysforteam sportsteam nets,1
coach jefffulchino athleteplayssport sport baseball,1
sportsteam houstonastros teamplaysinleague sportsleague mlb,1
personmexico luiscastillo athleteplayssport sport baseball,1
athlete montaellis athleteplaysforteam sportsteam goldenstatewarriors,1
sportsteam wisconsinbadgers teamplaysinleague sportsleague ncaa,1
athlete russellmartin athleteplaysinleague sportsleague mlb,1
athlete conorjackson athleteplaysinleague sportsleague mlb,1
athlete andrewmiller athleteplaysforteam sportsteam bucks,0
athlete brianroberts athleteledsportsteam sportsteam orioles,1
athlete mattwilliams athleteplayssport sport baseball,1
athlete orlandohernndez athleteplayssport sport baseball,1
athlete timredding athleteplayssport sport baseball,1
athlete troytulowitzki athleteplaysinleague sportsleague mlb,1
athlete scottlinebrink athleteplayssport sport baseball,1
sportsteam sacramentokings teamhomestadium stadiumoreventvenue arcoarena,1
athlete jakeplummer athleteledsportsteam sportsteam broncos,1
personmexico jorgecampillo athleteplayssport sport baseball,1
athlete ryandempster athleteplayssport sport baseball,1
athlete angelberroa athleteplayssport sport baseball,1
athlete sidneycrosby athletehomestadium stadiumoreventvenue mellonarena,1
sport baseball sportusesstadium stadiumoreventvenue threeriversstadium,1
athlete jasonmotte athleteplayssport sport baseball,1
athlete markgrace athleteplayssport sport baseball,1
sportsteam stlouiscardinals teamhomestadium stadiumoreventvenue buschmemorialstadium,1
athlete jarrodwashburn athleteplayssport sport baseball,1
athlete manuginobili athleteplaysforteam sportsteam spurs,1
personmexico mannyramirez athleteplayssport sport baseball,1
athlete luisvalbuena athleteplaysinleague sportsleague mlb,1
personasia juancruz athleteledsportsteam sportsteam newyorkyankees,0
athlete hedoturkoglu athleteplaysforteam sportsteam magic,1
sportsteam dodgers teamhomestadium stadiumoreventvenue dodgerstadium,1
athlete miltonbradley athleteplayssport sport baseball,1
athlete johnaxford athleteplaysinleague sportsleague mlb,1
athlete chadbradford athleteplaysinleague sportsleague mlb,1
athlete josecalderon athleteplaysforteam sportsteam raptors,1
athlete kurtwarner athleteplaysforteam sportsteam louiscardinals,0
athlete scottrolen athleteplaysinleague sportsleague mlb,1
personmexico michaelbourn athleteplaysinleague sportsleague mlb,1
athlete ramonsessions athleteplaysforteam sportsteam bucks,1
personmexico alfonsosoriano athleteplaysinleague sportsleague mlb,1
sportsleague nba leaguestadiums stadiumoreventvenue toyotacenter,1
athlete kellyjohnson athleteplayssport sport baseball,1
athlete bradpenny athleteplaysinleague sportsleague mlb,1
sportsteam coloradorockies teamhomestadium stadiumoreventvenue coorsfield,1
sportsteam lsu teamplaysinleague sportsleague ncaa,1
