triple,stv,truth
personmexico codyross athleteplaysinleague sportsleague mlb,0.4276425838,1
personmexico danuggla athleteplaysinleague sportsleague mlb,0.1153895333,1
personmexico codyross athleteplayssport sport baseball,0.4276425838,1
coach mikefontenot athleteplaysinleague sportsleague mlb,0.5414074659,1
coach johnbuck athleteplayssport sport baseball,0.4163707495,1
athlete carlospena athleteplayssport sport baseball,0.4191691875,1
sportsleague nfl leaguestadiums stadiumoreventvenue lpfield,0.4276425838,1
athlete reggienelson athleteledsportsteam sportsteam magic,0.419932425,0
athlete carsonpalmer athleteledsportsteam sportsteam bengals,0.4276425838,1
athlete edgarmartinez athleteplayssport sport baseball,0.4214894772,1
athlete jonathanvilma athleteplaysforteam sportsteam neworleanssaints,0.4154196978,1
athlete jonathanpapelbon athleteplayssport sport baseball,0.4372947514,1
personmexico jorgecantu athleteplayssport sport baseball,0.4169063568,1
athlete udonishaslem athleteplaysforteam sportsteam heat,0.4264131486,1
athlete kirbypuckett athleteplaysforteam sportsteam twins,0.4574891925,1
athlete pejastojakovic athleteledsportsteam sportsteam sacramentostatehornets,0.4076376295,0
athlete luisayala athleteplayssport sport baseball,0.4276425838,1
sportsleague nhl leaguestadiums stadiumoreventvenue aircanadacenter,0.4623410404,1
sportsteam atlantabraves teamhomestadium stadiumoreventvenue turnerfield,0.4171752036,1
personmexico joelzumaya athleteplaysinleague sportsleague mlb,0.4276426435,1
athlete claudiovargas athleteplayssport sport baseball,0.4534059167,1
athlete troytulowitzki athleteplayssport sport baseball,0.4344629347,1
coach markhendrickson athleteplayssport sport baseball,0.4276425838,1
athlete kevincash athleteplaysinleague sportsleague mlb,0.4276425838,1
athlete harmonkillebrew athleteplaysinleague sportsleague mlb,0.426105231,1
sportsteam newyorkmets teamplaysinleague sportsleague mlb,0.4162326753,1
athlete mikejacobs athleteplayssport sport baseball,0.4276425838,1
athlete jacquejones athleteplayssport sport baseball,0.4158916473,1
athlete fernandoabad coachesteam sportsteam newyorkmets,0.4333812594,0
personasia rickankiel athleteledsportsteam sportsteam louiscardinals,0.0427642584,0
athlete jairjurrjens athleteplaysinleague sportsleague mlb,0.4467203617,1
athlete joshjohnson athleteplayssport sport baseball,0.5130563974,1
sportsteam philadelphiaphillies teamhomestadium stadiumoreventvenue citizenbankpark,0.4330237806,1
athlete ronnyturiaf athleteplaysforteam sportsteam losangeleslakers,0.4493889809,1
athlete billmazeroski athleteplaysinleague sportsleague mlb,0.4276425838,1
athlete jeffkarstens athleteplayssport sport baseball,0.4234279096,1
athlete uguethurbina athleteplayssport sport baseball,0.4246463776,1
athlete chrisbritton athleteplayssport sport baseball,0.4276424646,1
athlete carlcrawford athleteplayssport sport baseball,0.4276425838,1
sportsteam bills teamhomestadium stadiumoreventvenue ralphwilsonstadium,0.489992559,1
athlete tywigginton athleteplaysforteam sportsteam houstonastros,0.4259421229,0
coach jj+AF8AXw-hardy athleteplayssport sport baseball,0.4643097818,1
sportsteam n1985chicagobears teamplaysinleague sportsleague nfl,0.4276425838,1
athlete rickynolasco athleteplaysinleague sportsleague mlb,0.4276425838,1
sportsteam portlandtrailblazers teamhomestadium stadiumoreventvenue rosegardenarena,0.6498667002,1
athlete williestargell athleteplayssport sport baseball,0.7095966935,1
personmexico josecontreras athleteplayssport sport baseball,0.4628247619,1
coach jj+AF8AXw-hardy athleteplaysinleague sportsleague mlb,0.4218543768,1
sportsteam reds teamplaysinleague sportsleague mlb,0.4276425838,1
athlete daisukematsuzaka athleteplaysinleague sportsleague mlb,0.4180829227,1
personmexico iansnell athleteplayssport sport baseball,0.4820273817,1
athlete bradbutler athleteledsportsteam sportsteam charlottebobcats,0.3956604898,0
athlete jasonvargas athleteplaysinleague sportsleague mlb,0.467564255,1
personmexico jasonmarquis athleteplaysinleague sportsleague mlb,0.4276425838,1
athlete jasonvargas athleteplayssport sport baseball,0.3988951445,1
athlete joemauer athleteplayssport sport baseball,0.4475468695,1
personasia brettgardner athleteplayssport sport baseball,0.4300121665,1
athlete jefffrancoeur athleteplaysforteam sportsteam atlantabraves,0.4153022468,1
athlete shawnestes athleteplayssport sport baseball,0.4180829227,1
athlete senecawallace athleteplaysforteam sportsteam seahawks,0.4195937812,1
athlete damioneasley athleteplaysinleague sportsleague mlb,0.4276425838,1
athlete natemclouth athleteplaysinleague sportsleague mlb,0.4276425838,1
athlete trentgreen athleteplaysforteam sportsteam rams,0.4153022468,1
athlete randywolf athleteplayssport sport baseball,0.3854900301,1
sportsteam leafs teamplaysinleague sportsleague nhl,0.4229934812,1
athlete ryanfreel athleteplaysinleague sportsleague mlb,0.4276423454,1
personmexico jasonfrasor athleteplaysinleague sportsleague mlb,0.422993511,1
sportsleague nba leaguestadiums stadiumoreventvenue americanairlinesarena,0.446823746,1
athlete matttreanor athleteplaysinleague sportsleague mlb,0.50589782,1
personmexico jorgesosa athleteplaysinleague sportsleague mlb,0.499307543,1
athlete ramonhernandez athleteplaysinleague sportsleague mlb,0.4259463549,1
sportsteam diamondbacks teamplaysinleague sportsleague mlb,0.4276425838,1
personmexico brianfuentes athleteplaysinleague sportsleague mlb,0.4106098115,1
athlete marcbulger athleteplaysforteam sportsteam rams,0.4276426733,1
athlete albertpujols athleteplaysinleague sportsleague mlb,0.4276425838,1
athlete billmueller athleteplaysinleague sportsleague mlb,0.4276425838,1
male alexrios athleteplaysforteam sportsteam bluejays,0.4276425838,1
personmexico alfredoamezaga athleteplayssport sport baseball,0.4276425838,1
personmexico markloretta athleteplayssport sport baseball,0.4998838305,1
personmexico brianfuentes athleteplayssport sport baseball,0.4276425838,1
personmexico jasonkubel athleteplayssport sport baseball,0.4177514017,1
athlete brettfarve athleteledsportsteam sportsteam packers,0.4276425838,1
athlete craigbiggio athleteplaysinleague sportsleague mlb,0.4276425838,1
athlete yunieskybetancourt athleteplaysinleague sportsleague mlb,0.446823746,1
athlete ryanfreel athleteledsportsteam sportsteam reds,0.4325021505,1
sportsteam clippers teamhomestadium stadiumoreventvenue staplescenter,0.4276425838,1
athlete mattholliday athleteplaysforteam sportsteam coloradorockies,0.4276425838,1
athlete mikecameron athleteplayssport sport baseball,0.965231508,1
athlete mikecameron athleteledsportsteam sportsteam brewers,0.4318557382,1
athlete lennydykstra athleteplaysinleague sportsleague mlb,0.4762189686,1
athlete octaviodotel athleteplayssport sport baseball,0.4373797476,1
athlete georgesherrill athleteplayssport sport baseball,0.4574847221,1
personus kobebryant athleteledsportsteam sportsteam losangeleslakers,0.7264121056,1
athlete scottlinebrink athleteplaysinleague sportsleague mlb,0.4786732495,1
athlete claybuchholz athleteplayssport sport baseball,0.4177514613,1
athlete caseyblake athleteplaysinleague sportsleague mlb,0.4196336567,1
athlete mikelowell athleteplayssport sport baseball,0.4276425838,1
athlete wilsonchandler athleteplaysforteam sportsteam knicks,0.4504233599,1
personmexico carlpavano athleteplaysinleague sportsleague mlb,1,1
personmexico michaelbourn athleteledsportsteam sportsteam houstonastros,0.4259463847,0
coach scottschoeneweis athleteplayssport sport baseball,0.3993825614,1
athlete blakedewitt athleteplayssport sport baseball,0.4276425838,1
sportsleague nfl leaguestadiums stadiumoreventvenue ralphwilsonstadium,0.4261480272,1
sportsteam atlantahawks teamhomestadium stadiumoreventvenue philipsarena,0.501691103,1
athlete andreabargnani athleteledsportsteam sportsteam raptors,0.497374922,1
athlete evanlongoria athleteplayssport sport baseball,0.4365056455,1
athlete charliebatch athleteledsportsteam sportsteam steelers,0.4338943958,1
athlete jamiemoyer athleteplaysinleague sportsleague mlb,0.5829318166,1
coach paulbyrd athleteplayssport sport baseball,0.4762240052,1
athlete rafaelsoriano athleteplaysinleague sportsleague mlb,0.4276425838,1
athlete josereyes athleteplaysinleague sportsleague mlb,0.4276425838,1
athlete akinoriiwamura athleteplaysforteam sportsteam tampabaydevilrays,0.4276425838,1
athlete berniewilliams athleteledsportsteam sportsteam newyorkyankees,0.4276425838,1
athlete brianmoehler athleteplaysinleague sportsleague mlb,0.4276425838,1
sportsteam mavericks teamhomestadium stadiumoreventvenue americanairlinescenter,0.0159104131,1
athlete shinsoochoo athleteplayssport sport baseball,0.4143873751,1
athlete cococrisp athleteplaysforteam sportsteam redsox,0.3992563188,1
athlete jedlowrie athleteplaysinleague sportsleague mlb,0.4476759434,1
athlete markreynolds athleteplaysinleague sportsleague mlb,0.4782646596,1
athlete shelleyduncan athleteplayssport sport baseball,0.395940274,1
personmexico michaelbourn athleteplayssport sport baseball,0.4166200161,1
athlete mikeschmidt athleteplayssport sport baseball,0.4956986308,1
athlete chuckjames athleteplaysinleague sportsleague mlb,0.4631760418,1
personmexico freddysanchez athleteplaysinleague sportsleague mlb,0.4476759434,1
coach markkotsay athleteplaysinleague sportsleague mlb,0.4335804582,1
athlete ryantheriot athleteplayssport sport baseball,0.5158090591,1
athlete koyiehill athleteplaysinleague sportsleague mlb,0.5640068054,1
coach sethsmith athleteplayssport sport baseball,0.4154525697,1
personmexico mattdiaz athleteplaysinleague sportsleague mlb,0.9362545609,1
sportsleague nfl leaguestadiums stadiumoreventvenue mcafeecoliseum,0.4276426435,1
male dye athleteplaysforteam sportsteam redsox,0.1722479284,0
athlete rickvandenhurk athleteplaysinleague sportsleague mlb,0.4113820791,1
sportsleague mlb leaguestadiums stadiumoreventvenue comerica,0.4254616201,1
personmexico daviddejesus athleteplaysinleague sportsleague mlb,0.4475468695,1
athlete kipwells athleteplaysinleague sportsleague mlb,0.4276425838,1
athlete joshhamilton athleteplaysinleague sportsleague mlb,0.4318322241,1
coach mikefontenot athleteplayssport sport baseball,0.4107668698,1
athlete jimrice athleteplaysinleague sportsleague mlb,0.4276425838,1
sportsteam philadelphia76ers teamplaysinleague sportsleague nba,0.5158090591,1
athlete freddiejones athleteplaysforteam sportsteam losangeleslakers,0.4749694765,1
athlete ericgordon athleteplaysforteam sportsteam clippers,0.4276425838,0
athlete davidprice athleteplaysinleague sportsleague mlb,0.4906888008,1
personmexico alexrodriguez athleteplaysforteam sportsteam newyorkyankees,0.446823746,1
personmexico jasonmarquis athleteplayssport sport baseball,0.5020970702,1
sportsteam oaklandathletics teamplaysinleague sportsleague mlb,0.4181512892,1
athlete woodywilliams athleteplayssport sport baseball,0.420143038,1
athlete markgrace athleteplaysinleague sportsleague mlb,0.4547978938,1
athlete fabriciooberto athleteplaysforteam sportsteam sanantonio,0.408213675,1
personmexico lukehudson athleteplayssport sport baseball,0.4115637541,1
sportsteam iowastate teamhomestadium stadiumoreventvenue jacktricestadium,0.5664188266,1
athlete georgebrett athleteplayssport sport baseball,0.4276425838,1
athlete timhudson athleteplaysinleague sportsleague mlb,0.3989317715,1
personmexico alexicasilla athleteplayssport sport baseball,0.4318557382,1
athlete jobachamberlain athleteplaysinleague sportsleague mlb,0.6202318072,1
athlete walterpayton athleteledsportsteam sportsteam broncos,0.2629473686,0
athlete philnevin athleteplayssport sport baseball,0.4276425838,1
athlete jasonkendall athleteplayssport sport baseball,0.4372947514,1
athlete jackierobinson athleteplaysforteam sportsteam brooklyndodgers,0.4466849864,1
athlete miltonbradley athleteplaysinleague sportsleague mlb,0.6821832657,1
athlete felixpie athleteledsportsteam sportsteam chicagocubs,0.7276426435,1
athlete chipperjones athleteplaysforteam sportsteam atlantabraves,0.4276425838,1
athlete petermoylan athleteplaysinleague sportsleague mlb,0.4474327564,1
sportsteam newyorkgiants teamhomestadium stadiumoreventvenue giantsstadium,0.4176021516,1
personmexico jaygibbons athleteledsportsteam sportsteam orioles,0.5916664004,1
athlete rickeyhenderson athleteplayssport sport baseball,0.4152041972,1
athlete bartstarr athleteplaysforteam sportsteam packers,0.4919268191,1
personmexico nickpunto athleteplaysforteam sportsteam twins,0.4276425838,1
athlete jimkelly athleteplaysforteam sportsteam bills,0.7456231117,1
athlete jeffkent athleteplayssport sport baseball,0.4276425838,1
personmexico brianmccann athleteplaysinleague sportsleague mlb,0.4241876602,1
coach joeborowski athleteplayssport sport baseball,0.4276425838,1
athlete jasonkendall athleteplaysinleague sportsleague mlb,0.6256498814,1
athlete takashisaito athleteplaysinleague sportsleague mlb,0.5276425838,1
athlete kellyjohnson athleteledsportsteam sportsteam atlantabraves,0.4276425838,1
sportsteam losangelesclippers teamhomestadium stadiumoreventvenue staplescenter,0.8276425838,1
personmexico markteahen athleteplaysinleague sportsleague mlb,0.4276425838,1
sportsteam memphisgrizzlies teamplaysinleague sportsleague nba,0.4276425838,1
sportsteam auburntigers teamhomestadium stadiumoreventvenue jordanharestadium,0.4276425838,1
athlete xaviernady athleteplaysforteam sportsteam newyorkyankees,0.4059870839,0
sport baseball sportusesstadium stadiumoreventvenue targetfield,0.4113820195,1
athlete samcassell athleteplaysforteam sportsteam bostonceltics,0.0820804238,1
athlete chadbradford athleteplayssport sport baseball,0.7305878401,1
athlete jacquejones athleteplaysinleague sportsleague mlb,0.7305878401,1
personmexico joeygathright athleteplaysinleague sportsleague mlb,0.4276425838,1
athlete alcidesescobar athleteplaysinleague sportsleague mlb,0.4148673117,1
personmexico adamloewen athleteplaysinleague sportsleague mlb,0.4276425838,1
athlete mattgarza athleteplayssport sport baseball,0.4793458283,1
sportsleague nfl leaguestadiums stadiumoreventvenue paulbrownstadium,0.4276425838,1
athlete alexeiramirez athleteplaysinleague sportsleague mlb,0.4065216482,1
athlete aj+AF8AXw-pierzynski athleteplaysinleague sportsleague mlb,0.4276425838,1
athlete jamesloney athleteplayssport sport baseball,0.4276425838,1
athlete chrislambert athleteplayssport sport baseball,0.9446027875,1
athlete alexeiramirez athleteplayssport sport baseball,0.4424107373,1
coach josejuanbarea athletehomestadium stadiumoreventvenue quickenloansarena,0.4258196056,1
athlete chadpennington athleteplaysforteam sportsteam newyorkjets,0.2173130393,0
athlete robbiefowler athleteplaysforteam sportsteam liverpool,0.3957529068,1
sportsteam buccaneers teamhomestadium stadiumoreventvenue st+AF8AXwBf-petetimesforum,0.5791468024,1
athlete nealcotts athleteplaysinleague sportsleague mlb,0.3949653506,1
athlete jeremyhermida athleteplayssport sport baseball,0.4213554561,1
sportsteam arizonadiamondbacks teamhomestadium stadiumoreventvenue chasefield,0.4276425838,1
sportsteam royals teamhomestadium stadiumoreventvenue kauffmanstadium,0.3854900301,1
athlete shaunlivingston athleteplaysforteam sportsteam clippers,0.4193560183,1
coach josejuanbarea coachesteam sportsteam cavaliers,0.4474327564,1
athlete kelennaazubuike athleteledsportsteam sportsteam goldenstatewarriors,0.4276425838,1
athlete carlcrawford athleteledsportsteam sportsteam tampabaydevilrays,0.2143872857,0
sportsleague nba leaguestadiums stadiumoreventvenue madisonsquaregarden,0.4956397116,1
athlete homerbailey athleteplaysinleague sportsleague mlb,0.4153022468,1
athlete philcoke athleteplayssport sport baseball,0.4154197276,1
athlete elimanning athleteledsportsteam sportsteam newyorkgiants,0.4154525697,1
sportsleague mlb leaguestadiums stadiumoreventvenue wrigleyfield,0.4280184209,1
athlete chaseutley athleteledsportsteam sportsteam magic,0.4998057485,1
athlete stevegarvey athleteplayssport sport baseball,0.4321557581,1
athlete gradysizemore athleteplayssport sport baseball,0.4070726633,1
athlete rickynolasco athleteplayssport sport baseball,0.4276425838,1
athlete markbuehrle athleteplayssport sport baseball,0.4276425838,1
athlete honuswagner athleteplayssport sport baseball,0.4276425838,1
athlete shinsoochoo athleteplaysinleague sportsleague mlb,0.4037350118,1
personmexico melkycabrera athleteplaysinleague sportsleague mlb,0.4276425838,1
coach jeffsamardzija athleteplaysinleague sportsleague mlb,0.4813362658,1
personaustralia davidpauley athleteplaysinleague sportsleague mlb,0.4828420579,1
athlete jeffnelson athleteplaysinleague sportsleague mlb,0.4276426435,1
athlete ryanbraun athleteledsportsteam sportsteam brewers,0.4480448067,1
athlete jaredreiner athleteplaysforteam sportsteam losangeleslakers,0.4276425838,1
coach markkotsay athleteplayssport sport baseball,0.4276425838,1
sportsteam pittsburghpenguins teamplaysinleague sportsleague nhl,0.4264363348,1
athlete bradradke athleteplayssport sport baseball,0.4148387313,1
sportsteam redskins teamhomestadium stadiumoreventvenue fedexfield,0.4276425838,1
sportsleague mlb leaguestadiums stadiumoreventvenue chasefield,0.4276425838,1
athlete mikegonzalez athleteplaysinleague sportsleague mlb,0.4276425838,1
athlete jp+AF8AXw-arencibia athleteplaysforteam sportsteam bills,0.4634473324,1
athlete mehmetokur athleteledsportsteam sportsteam jazz,0.4276425838,1
sportsteam portlandtrailblazers teamhomestadium stadiumoreventvenue rosegardenarena,0.672144711,1
athlete rafaelfurcal athleteplaysinleague sportsleague mlb,0.4436353147,1
sportsteam sanfrancisco49ers teamhomestadium stadiumoreventvenue candlestickpark,0.4276426435,0
athlete hankaaron athleteplayssport sport baseball,0.438273102,1
athlete russellbranyan athleteplayssport sport baseball,0.4344629347,1
athlete darrellrasner athleteplaysinleague sportsleague mlb,0.415430069,1
sportsteam stlouiscardinals teamplaysinleague sportsleague mlb,0.43302387,1
athlete akinoriiwamura athleteplayssport sport baseball,0.4276425838,1
personmexico brianmccann athleteplayssport sport baseball,0.4276425838,1
sportsteam philadelphia76ers teamhomestadium stadiumoreventvenue wachoviacenter,0.4044555724,1
athlete chrischambliss athleteplayssport sport baseball,0.7181856036,1
sportsleague mlb leaguestadiums stadiumoreventvenue safecofield,0.4267269373,1
sportsteam chicagobulls teamplaysinleague sportsleague nba,0.033894366,1
athlete brettfavre athleteledsportsteam sportsteam newyorkjets,0.446046412,0
athlete andrebarrett athleteplaysforteam sportsteam nets,0.9443958402,1
coach jefffulchino athleteplayssport sport baseball,0.5185357928,1
sportsteam houstonastros teamplaysinleague sportsleague mlb,0.4549107552,1
personmexico luiscastillo athleteplayssport sport baseball,0.4549107552,1
athlete montaellis athleteplaysforteam sportsteam goldenstatewarriors,0.4617270231,1
sportsteam wisconsinbadgers teamplaysinleague sportsleague ncaa,0.4276425838,1
athlete russellmartin athleteplaysinleague sportsleague mlb,0.4106097519,1
athlete conorjackson athleteplaysinleague sportsleague mlb,0.4736453891,1
athlete andrewmiller athleteplaysforteam sportsteam bucks,0.4344629347,0
athlete brianroberts athleteledsportsteam sportsteam orioles,0.4177514613,1
athlete mattwilliams athleteplayssport sport baseball,0.4407606125,1
athlete orlandohernndez athleteplayssport sport baseball,0.5916664004,1
athlete timredding athleteplayssport sport baseball,0.4410901666,1
athlete troytulowitzki athleteplaysinleague sportsleague mlb,0.4407606125,1
athlete scottlinebrink athleteplayssport sport baseball,0.5308241844,1
sportsteam sacramentokings teamhomestadium stadiumoreventvenue arcoarena,0.4856594503,1
athlete jakeplummer athleteledsportsteam sportsteam broncos,0.7036633492,1
personmexico jorgecampillo athleteplayssport sport baseball,0.4153741598,1
athlete ryandempster athleteplayssport sport baseball,0.425349474,1
athlete angelberroa athleteplayssport sport baseball,0.4338943958,1
athlete sidneycrosby athletehomestadium stadiumoreventvenue mellonarena,0.4143873155,1
sport baseball sportusesstadium stadiumoreventvenue threeriversstadium,0.4276425838,1
athlete jasonmotte athleteplayssport sport baseball,0.5379638076,1
athlete markgrace athleteplayssport sport baseball,0.4276425838,1
sportsteam st+AF8AXw-louiscardinals teamhomestadium stadiumoreventvenue buschmemorialstadium,0.4276426435,1
athlete jarrodwashburn athleteplayssport sport baseball,1,1
athlete manuginobili athleteplaysforteam sportsteam spurs,0.3992562592,1
personmexico mannyramirez athleteplayssport sport baseball,0.492549628,1
athlete luisvalbuena athleteplaysinleague sportsleague mlb,0.4276425838,1
personasia juancruz athleteledsportsteam sportsteam newyorkyankees,0.4276425838,0
athlete hedoturkoglu athleteplaysforteam sportsteam magic,0.4275161326,1
sportsteam dodgers teamhomestadium stadiumoreventvenue dodgerstadium,0.4276425838,1
athlete miltonbradley athleteplayssport sport baseball,0.4321393371,1
athlete johnaxford athleteplaysinleague sportsleague mlb,0.4276425838,1
athlete chadbradford athleteplaysinleague sportsleague mlb,0.4044215679,1
athlete josecalderon athleteplaysforteam sportsteam raptors,0.4276425838,1
athlete kurtwarner athleteplaysforteam sportsteam louiscardinals,0.0494691551,0
athlete scottrolen athleteplaysinleague sportsleague mlb,0.4321393371,1
personmexico michaelbourn athleteplaysinleague sportsleague mlb,0.4465464652,1
athlete ramonsessions athleteplaysforteam sportsteam bucks,0.4276425838,1
personmexico alfonsosoriano athleteplaysinleague sportsleague mlb,0.7265753746,1
sportsleague nba leaguestadiums stadiumoreventvenue toyotacenter,0.4276425838,1
athlete kellyjohnson athleteplayssport sport baseball,0.4106097221,1
athlete bradpenny athleteplaysinleague sportsleague mlb,0.4276425838,1
sportsteam coloradorockies teamhomestadium stadiumoreventvenue coorsfield,0.4276425838,1
sportsteam lsu teamplaysinleague sportsleague ncaa,0.4267039001,1
sportsleague nba leaguestadiums stadiumoreventvenue fedexforum,0.4276425838,1
sportsleague nba leaguestadiums stadiumoreventvenue aircanadacenter,0.6166383624,1
personmexico jackmorris athleteplayssport sport baseball,0.7238607407,1
personmexico jackwilson athleteplaysinleague sportsleague mlb,0.4276425838,1
personmexico jasonbartlett athleteplaysinleague sportsleague mlb,0.4078284204,1
athlete tadahitoiguchi athleteplayssport sport baseball,0.4169176221,1
athlete nomargarciaparra athleteplayssport sport baseball,0.4828420281,1
athlete andylaroche athleteplaysinleague sportsleague mlb,0.4203598201,1
athlete caseyblake athleteplayssport sport baseball,0.4257438779,1
coach brianburres athleteplaysinleague sportsleague mlb,0.5163173676,1
sportsteam coloradorockies teamplaysinleague sportsleague mlb,0.4040887356,1
athlete kellyshoppach athleteplaysinleague sportsleague mlb,0.5025786757,1
athlete armandogalarraga athleteplaysinleague sportsleague mlb,0.4346316457,1
athlete shawngreen athleteplayssport sport baseball,0.4333811402,1
sportsteam purdueboilermakers teamplaysinleague sportsleague ncaa,0.4572899044,1
athlete kevinmartin athleteplaysforteam sportsteam kings,0.425349474,1
sportsleague nfl leaguestadiums stadiumoreventvenue invescofield,0.4783171713,1
athlete thome athleteplayssport sport baseball,0.5499971509,1
athlete asdrubalcabrera athleteplaysinleague sportsleague mlb,0.4257425964,1
coach greggpopovich coachesteam sportsteam sanantonio,0.4276425838,1
coach juanencarnacion athleteplayssport sport baseball,0.4276426435,1
athlete kengriffeyjr athleteplaysforteam sportsteam reds,0.4276425838,1
athlete tonygwynn athleteplayssport sport baseball,0.4849816263,1
athlete marcoestrada athleteplayssport sport baseball,0.4276425838,1
coach kameronloe athleteplaysinleague sportsleague mlb,0.4849816859,1
sportsgame n2002worldcup sportsgamewinner sportsteam brazil,0.4203598201,1
athlete jonathanpapelbon athleteplaysinleague sportsleague mlb,0.411806196,1
athlete guillermomota athleteplayssport sport baseball,0.4252923727,1
sportsteam packers teamplaysinleague sportsleague nfl,0.4742409885,1
athlete chaseungbaek athleteplayssport sport baseball,0.4929628372,1
athlete brianbuscher athleteplayssport sport baseball,0.4276425838,1
athlete cleonjones athleteplaysinleague sportsleague mlb,0.4419024885,1
athlete kirbypuckett athleteledsportsteam sportsteam twins,0.427642554,1
athlete giambi athleteplaysforteam sportsteam newyorkyankees,0.4276425838,1
coach loviesmith coachesteam sportsteam n1985chicagobears,0.2276425838,0
personmexico tinomartinez athleteplaysinleague sportsleague mlb,0.4790124595,1
athlete berniewilliams athleteplaysforteam sportsteam newyorkyankees,0.4276425838,1
athlete ryanshealy athleteplayssport sport baseball,0.0183418393,1
athlete briangriese athleteplaysforteam sportsteam n1985chicagobears,0.4167755246,1
athlete petermoylan athleteplayssport sport baseball,0.4106097221,1
athlete ryanbraun athleteplayssport sport baseball,0.4276425838,1
personmexico mattcapps athleteplayssport sport baseball,0.4163707495,1
coach dennisfelton worksfor sportsteam alabamaaandmbulldogs,0.5657536983,1
athlete chrisnarveson athleteplayssport sport baseball,0.4074460566,1
athlete hanleyramirez athleteplayssport sport baseball,0.4802261293,1
coach dennisfelton coachesteam sportsteam alabamaaandmbulldogs,0.4480448067,1
athlete justinmorneau athleteplaysforteam sportsteam twins,0.4276425838,1
athlete mitchstetter athleteplayssport sport baseball,0.4276425838,1
athlete rafaelbetancourt athleteplaysinleague sportsleague mlb,0.4193560183,1
sportsgame n1999worldseries sportsgamewinner sportsteam newyorkyankees,0.3854900002,1
athlete jrrussell athleteledsportsteam sportsteam oaklandraiders,0.4276425838,1
athlete miltonbradley athleteledsportsteam sportsteam chicagocubs,0.2132139921,0
athlete tadahitoiguchi athleteplaysinleague sportsleague mlb,0.4044555724,1
athlete carllandry athleteledsportsteam sportsteam rockets,0.4276425838,1
sportsleague ncaa leaguestadiums stadiumoreventvenue spartanstadium,0.4276425838,1
