triple,stv,truth
athlete kellyshoppach athleteplayssport sport baseball,0.4276426733,1
athlete alexeiramirez athleteplaysforteam sportsteam redsox,0.4957170486,1
athlete joakimsoria athleteplayssport sport baseball,0.4276425838,1
athlete sagerosenfels athleteplaysforteam sportsteam texans,0.7977887392,0
sportsteam sandiegochargers teamplaysinleague sportsleague mlb,0.2720447361,0
athlete dontrellewillis athleteplayssport sport baseball,0.4276425838,1
athlete tylerclippard athleteplaysinleague sportsleague mlb,0.5359350443,1
athlete pelfrey athleteplaysforteam sportsteam newyorkmets,0.4213554859,1
athlete michaelfinley athleteplaysforteam sportsteam spurs,0.4584441781,0
sportsteam n1985chicagobears teamhomestadium stadiumoreventvenue soldierfield,0.7200530767,1
personmexico edinsonvolquez athleteplayssport sport baseball,0.4343757331,1
athlete tomseaver athleteplaysinleague sportsleague mlb,0.4276425838,0
personmexico alfonsosoriano athleteplaysforteam sportsteam chicagocubs,0.4500778615,1
athlete aj+AF8AXw-pierzynski athleteplayssport sport baseball,0.4276426435,1
athlete conorjackson athleteplaysforteam sportsteam diamondbacks,0.1185357928,0
sportsteam twins teamhomestadium stadiumoreventvenue metrodome,0.4276425838,1
athlete johansantana athleteplayssport sport baseball,0.4258021414,1
athlete davidprice athleteledsportsteam sportsteam jazz,0.3258021414,0
athlete mattflynn athleteplayssport sport baseball,0.4224498272,1
athlete andrewmiller athleteledsportsteam sportsteam bucks,0.4433383048,1
sportsteam neworleanshornets teamhomestadium stadiumoreventvenue neworleansarena,0.9443958402,1
personmexico wandyrodriguez athleteplaysinleague sportsleague mlb,0.4344629347,1
athlete chrissnyder athleteplayssport sport baseball,0.4010511041,1
athlete joebeimel athleteplayssport sport baseball,0.491615504,1
sportsteam hawks teamhomestadium stadiumoreventvenue philipsarena,0.42559129,1
athlete placidopolanco athleteplayssport sport baseball,0.4276425838,1
sportsteam st+AF8AXw-louiscardinals teamplaysinleague sportsleague mlb,0.4276425838,1
athlete jefffassero athleteplaysinleague sportsleague mlb,0.4276425838,1
personmexico hustonstreet athleteplayssport sport baseball,0.4480448067,1
personmexico brianbannister athleteplayssport sport baseball,0.4198715985,1
athlete joshphelps athleteplayssport sport baseball,0.4276425838,1
athlete jongarland athleteplayssport sport baseball,0.9850687385,1
athlete luisaparicio athleteplaysinleague sportsleague mlb,0.4106097221,1
sportsteam blackhawks teamhomestadium stadiumoreventvenue wrigleyfield,0.4180448067,0
athlete peavy athleteplayssport sport baseball,0.4153741896,0
athlete pedroia athleteledsportsteam sportsteam redsox,0.4276425838,1
athlete brianbuscher athleteplaysinleague sportsleague mlb,0.4257874191,1
athlete mattmurton athleteplayssport sport baseball,0.4276426435,1
athlete chrissnyder athleteplaysinleague sportsleague mlb,0.978376473,1
sportsteam newyorkgiants teamplaysinleague sportsleague nfl,0.4257874191,1
athlete lidstrom athleteplaysforteam sportsteam redwings,0.4782646,1
athlete scottbaker athleteplaysinleague sportsleague mlb,0.4915444553,1
athlete williestargell athleteplaysinleague sportsleague mlb,0.4119512737,0
personmexico michaelwuertz athleteplaysinleague sportsleague mlb,0.4355515242,1
sportsteam utahjazz teamhomestadium stadiumoreventvenue energysolutionsarena,0.5985111594,1
coach joshbeckett athleteplaysinleague sportsleague mlb,0.4070745409,1
athlete darrencollison athleteledsportsteam sportsteam ucla,0.4291692674,0
athlete carsonpalmer athleteplaysforteam sportsteam bengals,0.4338943958,0
athlete pudgerodriguez athleteplaysinleague sportsleague mlb,0.0309900846,1
athlete blaineboyer athleteplayssport sport baseball,0.4010511041,1
personmexico ivanrodriguez athleteplayssport sport baseball,0.4063877165,1
sportsteam tennesseevolunteers teamhomestadium stadiumoreventvenue neylandstadium,0.4502239227,1
coach brianbruney athleteplayssport sport baseball,0.4467203617,1
personmexico clintbarmes athleteplayssport sport baseball,0.4010511041,1
athlete blaineboyer athleteplaysinleague sportsleague mlb,0.4276425838,1
athlete mattlaporta athleteplaysinleague sportsleague mlb,0.4276425838,1
personmexico wandyrodriguez athleteplayssport sport baseball,0.7545145154,1
athlete berniewilliams athleteplayssport sport baseball,0.5264557004,1
sportsteam st+AF8AXwBf-louiscardinals teamplaysinleague sportsleague mlb,0.5158090591,1
athlete kenjijohjima athleteplayssport sport baseball,0.4794039726,1
athlete denardspan athleteplayssport sport baseball,0.4291692376,1
personmexico lyleoverbay athleteplayssport sport baseball,0.0161130857,1
athlete markanderson athleteplaysforteam sportsteam newenglandpatriots,0.944601953,1
athlete bretttomko athleteplaysinleague sportsleague mlb,0.4143872857,1
athlete chuckknoblauch athleteplaysinleague sportsleague mlb,0.4944609702,1
personasia carlosarroyo athleteplaysforteam sportsteam magic,0.4214718044,1
athlete markreynolds athleteledsportsteam sportsteam diamondbacks,0.4633439183,1
athlete sidneyponson athleteplayssport sport baseball,0.9771475792,1
sportsleague nhl leaguestadiums stadiumoreventvenue verizoncenter,0.4170363545,0
athlete markderosa athleteplaysinleague sportsleague mlb,0.4276425838,1
athlete rudygay athleteledsportsteam sportsteam memphisgrizzlies,0.4932035506,1
sportsteam bengals teamhomestadium stadiumoreventvenue paulbrownstadium,0.4276427329,1
athlete alreyes athleteplayssport sport baseball,0.4503163695,1
athlete chrischambliss athleteplaysinleague sportsleague mlb,0.4276424646,1
athlete mattholliday coachesteam sportsteam coloradorockies,0.4076425838,0
sportsteam rockets teamplaysinleague sportsleague nba,0,1
athlete akinoriiwamura athleteledsportsteam sportsteam tampabaydevilrays,0.4402164221,1
sportsleague nfl leaguestadiums stadiumoreventvenue clevelandbrownsstadium,0.4917194843,1
personmexico adamlaroche athleteplaysinleague sportsleague mlb,0.4545196891,1
athlete shawngreen athleteplaysinleague sportsleague mlb,0.4040887356,1
athlete mikeaviles athleteplaysinleague sportsleague mlb,0.4154197574,1
personmexico adameverett athleteplaysinleague sportsleague mlb,0.4731384218,1
sportsteam sanfranciscogiants teamhomestadium stadiumoreventvenue candlestickpark,0.4475468695,1
sportsteam heat teamhomestadium stadiumoreventvenue americanairlinesarena,0.4254616797,1
coach kevinkouzmanoff athleteplaysinleague sportsleague mlb,0.4276425838,1
personmexico jasonbartlett athleteplayssport sport baseball,0.4276425838,1
sportsleague nba leaguestadiums stadiumoreventvenue philipsarena,0.4581270218,1
athlete alreyes athleteplaysinleague sportsleague mlb,0.4213554561,1
athlete jeffweaver athleteplaysinleague sportsleague mlb,0.4207159579,1
athlete chrisyoung athleteplaysinleague sportsleague mlb,0.4276425838,1
sportsteam broncos teamhomestadium stadiumoreventvenue invescofield,0.395940274,1
coach richardjefferson athleteledsportsteam sportsteam nets,0.4561943412,1
sportsleague nfl leaguestadiums stadiumoreventvenue louisianasuperdome,0.4276425838,1
athlete kevincash athleteplayssport sport baseball,0.030913258,1
personmexico brandonphillips athleteplayssport sport baseball,0.4276425838,1
athlete kenjijohjima athleteplaysinleague sportsleague mlb,0.4276426435,1
personmexico lastingsmilledge athleteplaysforteam sportsteam newyorkmets,0.4313019216,1
athlete kerrycollins athleteledsportsteam sportsteam titans,0.3276425838,0
coach johnmaine athleteplayssport sport baseball,0.4143872857,1
athlete conorjackson athleteledsportsteam sportsteam diamondbacks,0.4257873893,1
sportsleague mlb leaguestadiums stadiumoreventvenue yankeestadium,0.4257873893,1
athlete cristhianmartinez athleteplayssport sport baseball,0.4276425838,1
sportsteam neworleanssaints teamplaysinleague sportsleague nfl,0.4276425838,1
athlete ryantheriot athleteplaysinleague sportsleague mlb,0.4003387392,1
personasia brettgardner athleteplaysforteam sportsteam chicagocubs,0.4276425838,0
athlete andrayblatche athleteledsportsteam sportsteam washingtonwizards,0.4276425838,1
athlete bradausmus athleteplayssport sport baseball,0.4474327564,1
sportsteam capitals teamhomestadium stadiumoreventvenue verizoncenter,0.5289373398,1
athlete brianroberts athleteplaysforteam sportsteam orioles,0.4661594331,1
coach mattguerrier athleteplaysinleague sportsleague mlb,0.4209414423,1
athlete joemays athleteplayssport sport baseball,0.4085102677,1
sportsteam bostonceltics teamhomestadium stadiumoreventvenue tdbanknorthgarden,0.4105223119,1
athlete mussina athleteplaysforteam sportsteam newyorkyankees,0.4402164221,1
athlete trentedwards athleteplaysforteam sportsteam bills,0.0183417797,0
sport baseball sportusesstadium stadiumoreventvenue historicfenwaypark,0.4190083146,1
athlete chipperjones athleteledsportsteam sportsteam atlantabraves,0.7170047164,1
athlete bradeldred athleteplayssport sport baseball,0.4116343558,1
sportsteam pirates teamplaysinleague sportsleague mlb,0.4334958494,1
athlete yunelescobar athleteplayssport sport baseball,0.4666101336,1
athlete briangiles athleteplayssport sport baseball,0.4474327564,1
coach petecarroll coachesteam sportsteam usc,0.372669518,1
athlete kurtbusch athleteplaysforteam sportsteam baltimorecolts,0.4951241612,1
sportsleague nfl leaguestadiums stadiumoreventvenue lambeaufield,0.4258260131,1
personmexico clintbarmes athleteplaysinleague sportsleague mlb,0.4270198047,1
athlete juliofranco athleteplaysinleague sportsleague mlb,0.5654275417,1
athlete wilsonchandler athleteledsportsteam sportsteam knicks,0.4185357928,0
athlete philhughes athleteplaysinleague sportsleague mlb,0.4289426208,1
personmexico chrissampson athleteplayssport sport baseball,0.4276425838,1
personmexico marianorivera athleteplaysinleague sportsleague mlb,0.7025437951,1
athlete stevecarlton athleteplaysinleague sportsleague mlb,0.142035985,0
personmexico jameswhite athleteledsportsteam sportsteam chicagobulls,0.4470738173,0
athlete jimrice athleteledsportsteam sportsteam bostonred,0.4276427925,1
athlete bradradke athleteplaysinleague sportsleague mlb,0.4594423771,1
athlete dirknowitzki athleteledsportsteam sportsteam mavericks,0.4328525066,1
athlete chaseungbaek athleteplaysinleague sportsleague mlb,0.4276423454,1
sportsteam steelers teamhomestadium stadiumoreventvenue heinzfield,0.4830569327,1
athlete roycering athleteplayssport sport baseball,0.4276425838,1
sportsleague nfl leaguestadiums stadiumoreventvenue gillettestadium,0.4453090131,1
athlete patneshek athleteplaysinleague sportsleague mlb,0.3957529068,1
athlete trentgreen athleteledsportsteam sportsteam rams,0.4545196891,1
athlete claudiovargas athleteplaysinleague sportsleague mlb,0.4166258872,1
sportsleague mlb leaguestadiums stadiumoreventvenue turnerfield,0.4251219928,1
athlete joedimaggio athleteplaysinleague sportsleague mlb,0.4538307786,0
sportsteam auburntigers teamplaysinleague sportsleague ncaa,0.4061078537,1
sportsleague nba leaguestadiums stadiumoreventvenue neworleansarena,0.5163173676,1
sportsleague mlb leaguestadiums stadiumoreventvenue dodgerstadium,0.4276425838,1
athlete linaskleiza athleteplaysforteam sportsteam nuggets,0.4276425838,1
sportsleague nba leaguestadiums stadiumoreventvenue rosegardenarena,0.4335803986,1
athlete jasonphillips athleteplayssport sport baseball,0.4474327564,1
athlete nady athleteledsportsteam sportsteam newyorkyankees,0.3854899704,1
coach mattguerrier athleteplayssport sport baseball,0.4063877165,1
athlete oscarvillarreal athleteplayssport sport baseball,0.4542659223,1
personmexico vladimirguerrero athleteplaysforteam sportsteam anaheimangels,0.4276426435,1
athlete jeffkarstens athleteplaysinleague sportsleague mlb,0.9070070386,1
athlete johansantana athleteplaysinleague sportsleague mlb,0.4172034264,1
athlete gaylordperry athleteplayssport sport baseball,0.4480448067,1
sportsleague nfl leaguestadiums stadiumoreventvenue cowboysstadium,0.4177842438,1
athlete samardosamuels athleteledsportsteam sportsteam louiscardinals,0.4106097519,1
athlete dmitriyoung athleteplayssport sport baseball,0.4106097519,1
athlete briangiles athleteledsportsteam sportsteam sandiegochargers,0.430123806,1
sportsteam redskins teamplaysinleague sportsleague nfl,0.4276425838,1
athlete mikecameron athleteplaysinleague sportsleague mlb,0.4224498272,1
athlete jeremyhermida athleteledsportsteam sportsteam marlins,0.4052715898,1
athlete josereyes athleteledsportsteam sportsteam newyorkmets,0.4096850157,1
sportsteam clippers teamplaysinleague sportsleague nba,0.4276426435,1
athlete bradpenny athleteplayssport sport baseball,0.4276425838,1
sportsteam rams teamhomestadium stadiumoreventvenue edwardjonesdome,0.4678767323,1
personmexico gregbiffle athleteplaysforteam sportsteam dodgers,0.4146520197,1
athlete mikecameron athleteplaysforteam sportsteam brewers,0.4321393967,1
sportsteam losangeleslakers teamplaysinleague sportsleague nba,0.4321393371,1
coach ryanspilborghs athleteplayssport sport baseball,0.4276425838,1
athlete princefielder athleteplayssport sport baseball,0.5510798097,1
personmexico toddcoffey athleteplaysinleague sportsleague mlb,0.4390053749,1
coach kevinyoukilis athleteplayssport sport baseball,0.4274127483,1
athlete seanhenn athleteplaysinleague sportsleague mlb,0.5348356962,1
athlete derosa athleteplaysforteam sportsteam chicagocubs,0.3849399388,1
athlete brianbass athleteplayssport sport baseball,0.4276426435,1
athlete markteixeira athleteplaysinleague sportsleague mlb,0.4274803698,1
athlete kipwells athleteplayssport sport baseball,0.4253696799,1
sportsleague ncaa leaguestadiums stadiumoreventvenue rossadestadium,0.4065217078,1
athlete joedimaggio athleteplayssport sport baseball,0.4390424788,1
athlete andysonnanstine athleteplayssport sport baseball,0.4213554561,1
athlete alanembree athleteplaysinleague sportsleague mlb,0.3849399984,1
athlete rickvandenhurk athleteplayssport sport baseball,0.4276425838,1
coach joeborowski athleteplaysinleague sportsleague mlb,0.0159104355,1
personmexico coreyhart athleteplaysinleague sportsleague mlb,0.4489734173,1
male alexrios athleteplayssport sport baseball,0.4255886972,1
coach jeffsamardzija athleteplayssport sport baseball,0.4545196891,1
athlete clameredith athleteplayssport sport baseball,0.4276425838,1
athlete jameycarroll athleteplayssport sport baseball,0.4276426136,1
athlete ericgordon athleteledsportsteam sportsteam clippers,0.4956397116,1
personmexico mickeycochrane athleteplayssport sport baseball,0.4245533347,1
athlete joemorgan athleteplaysinleague sportsleague mlb,0.4660900533,1
sportsteam alabamacrimsontide teamhomestadium stadiumoreventvenue bryantdenny,0.4143873155,1
athlete jongarland athleteplaysinleague sportsleague mlb,0.6806240082,1
athlete philnevin athleteplaysinleague sportsleague mlb,0.4134325087,1
sportsteam losangeleslakers teamhomestadium stadiumoreventvenue staplescenter,0.3854900599,1
athlete mattryan athleteledsportsteam sportsteam bostoncollege,0.4163707197,1
athlete amarestoudemire athleteplaysforteam sportsteam suns,0.4433383048,1
athlete jimrice athleteplayssport sport baseball,0.4693466723,1
athlete philhughes athleteplayssport sport baseball,0.4319685996,1
athlete ronnycedeno athleteplayssport sport baseball,0.468024075,1
athlete pedromartinez athleteplayssport sport baseball,0.4587928057,1
athlete andreabargnani athleteplaysforteam sportsteam raptors,0.4768230319,1
athlete goosegossage athleteplayssport sport baseball,0.4276425838,1
personmexico ryanchurch athleteplaysforteam sportsteam newyorkmets,0.4976247549,1
athlete otisnixon athleteplayssport sport baseball,0.4154197276,1
coach horacioramirez athleteplaysinleague sportsleague mlb,0.4244270027,1
coach derrickturnbow athleteplayssport sport baseball,0.4324305952,1
personmexico adamlaroche athleteplayssport sport baseball,0.4372947514,1
sportsleague nba leaguestadiums stadiumoreventvenue timewarnercableamphitheater,0.0654562116,0
athlete evanmeek athleteplaysinleague sportsleague mlb,0.613586247,1
athlete joeblanton athleteplaysinleague sportsleague mlb,0.4352600574,1
coach sethsmith athleteplaysinleague sportsleague mlb,0.431997627,1
sportsteam magic teamhomestadium stadiumoreventvenue amwayarena,0.4813996553,1
athlete vladimirradmanovic athleteplaysforteam sportsteam losangeleslakers,0.4357682168,1
athlete justinmorneau athleteledsportsteam sportsteam twins,0.431997627,1
athlete jalenrose athleteplaysinleague sportsleague mlb,0.4010511041,1
athlete patneshek athleteplayssport sport baseball,0.4276425838,1
athlete hidekiokajima athleteledsportsteam sportsteam newyorkyankees,0.5916664004,1
coach josejuanbarea athleteledsportsteam sportsteam cavaliers,0.8926930428,1
athlete dustinpedroia athleteplaysinleague sportsleague mlb,0.4557040632,1
athlete mattflynn athleteplaysinleague sportsleague mlb,0.3854900301,0
sportsteam bills teamplaysinleague sportsleague nfl,0.4444671571,1
athlete carsonpalmer athletehomestadium stadiumoreventvenue paulbrownstadium,0.4475468695,1
sportsleague nba leaguestadiums stadiumoreventvenue tdbanknorthgarden,0.4276426435,1
athlete jimleyritz athleteplaysinleague sportsleague mlb,0.4203598499,1
athlete cococrisp athleteplaysinleague sportsleague mlb,0.3726695776,1
personmexico khalilgreene athleteledsportsteam sportsteam sandiegochargers,0.4076425838,0
personmexico adriangonzalez athleteplaysinleague sportsleague mlb,0.4276425838,1
athlete rajonrondo athleteledsportsteam sportsteam bostonceltics,0.4163707495,1
athlete jasonmotte athleteplaysinleague sportsleague mlb,0.0183418393,1
athlete philiprivers athleteledsportsteam sportsteam sandiegochargers,0.4063876867,1
athlete movaughn athleteplaysinleague sportsleague mlb,0.4177514613,1
athlete randyjohnson athleteplaysinleague sportsleague mlb,0.4276425838,1
coach horacioramirez worksfor sportsteam redsox,0.4148673117,1
athlete danfouts athleteplaysforteam sportsteam sandiegochargers,0.4276425838,1
athlete nolanryan athleteplayssport sport baseball,0.4276425838,1
athlete noahlowry athleteledsportsteam sportsteam n1985chicagobears,0.345820868,0
personmexico mattdiaz athleteplayssport sport baseball,0.4256930053,1
personmexico raulvaldes athleteplayssport sport baseball,0.4276425838,1
athlete shaq athleteledsportsteam sportsteam suns,0.3854900301,1
athlete raferalston athleteplaysforteam sportsteam rockets,0.418163985,1
coach paulbyrd athleteplaysinleague sportsleague mlb,0.4897687435,1
personmexico mattkemp athleteplayssport sport baseball,0.5098163486,1
athlete kevinbrown athleteplayssport sport baseball,0.4044358432,1
sportsteam clevelandbrowns teamhomestadium stadiumoreventvenue clevelandbrownsstadium,0.4276425838,1
athlete micahowings athleteplaysinleague sportsleague mlb,0.5499971509,1
athlete alantrammell athleteplayssport sport baseball,0.4276425838,1
personmexico caseykotchman athleteplayssport sport baseball,0.4244270325,1
athlete justinverlander athleteplaysinleague sportsleague mlb,0.414283067,1
athlete jesselitsch athleteplaysinleague sportsleague mlb,0.4808061123,1
personmexico jorgeposada athleteplaysinleague sportsleague mlb,0.4802318513,1
sportsteam knicks teamplaysinleague sportsleague nba,0.4393496811,1
athlete mikegonzalez athleteplayssport sport baseball,0.4594423771,1
sportsteam clevelandindians teamplaysinleague sportsleague mlb,0.4276426733,1
athlete cococrisp athleteplayssport sport baseball,0.4153741896,1
athlete stevecarlton athleteplayssport sport baseball,0.4276426435,1
coach mikemacdougal athleteplaysinleague sportsleague mlb,0.4276425838,1
athlete trentedwards athleteledsportsteam sportsteam bills,0.4177514613,1
sportsleague mlb leaguestadiums stadiumoreventvenue petcopark,0.4849947989,1
athlete zackgreinke athleteplaysinleague sportsleague mlb,0.6545621157,1
athlete adrianbeltre athleteledsportsteam sportsteam seattlemariners,0.1088840365,1
athlete scotthairston athleteplaysinleague sportsleague mlb,0.4106097221,1
personmexico franciscogarcia athleteplayssport sport baseball,0.5158090591,1
athlete carlospena athleteledsportsteam sportsteam tampabaydevilrays,0.4231097996,1
athlete bjupton athleteplaysinleague sportsleague mlb,0.4143873155,1
athlete adrianbeltre athleteplaysforteam sportsteam seattlemariners,0.4453456998,1
athlete ccsabathia athleteplaysinleague sportsleague mlb,0.4276425838,1
athlete rajonrondo athleteplaysforteam sportsteam bostonceltics,0.4944666922,1
athlete sergioromo athleteplaysinleague sportsleague mlb,0.8979751468,1
personmexico morganensberg athleteplayssport sport baseball,0.4276425838,1
personmexico jameswhite athletehomestadium stadiumoreventvenue unitedcenter,0.5045385361,1
personmexico luiscastillo athleteplaysinleague sportsleague mlb,0.4640536606,1
personmexico carlosbeltran athleteplaysforteam sportsteam newyorkmets,0.4276425838,1
athlete kirkhinrich athleteledsportsteam sportsteam chicagobulls,0.4227363467,1
coach briansanches athleteplayssport sport baseball,0.3988951743,1
coach brianbruney athleteplaysinleague sportsleague mlb,0.4276425838,1
personmexico gregbiffle athleteledsportsteam sportsteam dodgers,0.4176021516,1
personmexico vernonwells athleteledsportsteam sportsteam bluejays,0.4276425838,1
personmexico joeinglett athleteplaysinleague sportsleague mlb,0.4057770371,1
sportsteam tampabayrays teamplaysinleague sportsleague mlb,0.6785395741,1
athlete rossgload athleteplayssport sport baseball,0.4276425838,1
athlete eddiemathews athleteplayssport sport baseball,0.4319302142,1
athlete noahlowry athleteplaysforteam sportsteam n1985chicagobears,0.4148387313,0
athlete mattwilliams athleteplaysinleague sportsleague mlb,0.4203598499,1
athlete santiagocasilla athleteplaysinleague sportsleague mlb,0.5263696909,1
athlete paulmaholm athleteplaysinleague sportsleague mlb,0.4219574928,1
athlete hakimwarrick athleteledsportsteam sportsteam reds,0.3993825912,0
athlete kevinmillar athleteplaysinleague sportsleague mlb,0.4276425838,1
athlete davidortiz athleteplaysforteam sportsteam redsox,0.4134325087,1
coach joseceda athleteplaysinleague sportsleague mlb,0.4633438587,1
athlete estebanloaiza athleteplaysinleague sportsleague mlb,0.4276426435,1
coach horacioramirez athleteledsportsteam sportsteam redsox,0.4276427329,1
athlete xaviernady athleteledsportsteam sportsteam newyorkyankees,0.4467203617,1
athlete davidortiz athleteplayssport sport baseball,0.4163707495,1
personmexico carlosbeltran athleteplayssport sport baseball,0.4276425838,1
personmexico michaelbarrett athleteplayssport sport baseball,0.7334579825,1
athlete adambostick athleteplayssport sport baseball,0.4276425838,1
personmexico danuggla athleteledsportsteam sportsteam marlins,0.4276425838,1
personmexico nickpunto athleteplayssport sport baseball,0.4211134315,1
athlete luisvalbuena athleteplayssport sport baseball,0.4276425838,1
personmexico jasonfrasor athleteplayssport sport baseball,0.4276426733,1
athlete jaketsakalidis athleteplayssport sport baseball,0.4276425838,0
athlete jeffkent athleteplaysforteam sportsteam dodgers,0.4276425838,1
sportsteam wisconsinbadgers teamhomestadium stadiumoreventvenue camprandallstadium,0.4276423454,1
athlete jimjohnson athleteplayssport sport baseball,0.5842850208,1
athlete davidprice athleteplaysforteam sportsteam jazz,0.2614673734,0
athlete markbuehrle athleteplaysinleague sportsleague mlb,0.4276425838,1
personmexico jackmorris athleteplaysinleague sportsleague mlb,0.4276426435,1
personmexico shanevictorino athleteplayssport sport baseball,0.4210639894,1
athlete jeffnelson athleteplayssport sport baseball,0.4144337773,1
athlete kengriffeyjr athleteledsportsteam sportsteam reds,0.4093002081,1
personmexico brianbannister athleteplaysinleague sportsleague mlb,0.8926930428,1
personmexico chrisiannetta athleteplaysinleague sportsleague mlb,0.0334255755,1
athlete mikerabelo athleteplayssport sport baseball,0.5500075817,1
athlete honuswagner athleteplaysinleague sportsleague mlb,0.4372947514,1
sportsleague mlb leaguestadiums stadiumoreventvenue jacobsfield,0.4276426435,1
athlete mikerabelo athleteplaysinleague sportsleague mlb,0.4373797476,1
athlete cj+AF8AXw-wilson athleteplaysinleague sportsleague mlb,0.3854900301,1
athlete timredding athleteplaysinleague sportsleague mlb,0.4276425838,1
athlete dexterfowler athleteplayssport sport baseball,0.4408161044,1
athlete samardosamuels athleteplaysforteam sportsteam louiscardinals,0.0453933001,0
athlete otisnixon athleteplaysinleague sportsleague mlb,0.4333811402,1
personmexico nickpunto athleteledsportsteam sportsteam twins,0.4134325385,1
athlete kosukefukudome athleteplayssport sport baseball,0.3849399984,1
athlete baberuth athleteplaysforteam sportsteam newyorkyankees,0.3113820195,0
athlete chadqualls athleteplayssport sport baseball,0.5185357332,1
athlete jaysonwerth athleteplaysinleague sportsleague mlb,0.427351743,1
personmexico jameswhite athleteplaysforteam sportsteam chicagobulls,0.4248111844,1
personafrica troysmith athleteplaysforteam sportsteam baltimorecolts,0.3474327564,0
athlete andruwjones athleteplaysinleague sportsleague mlb,0.4267504215,1
coach scottschoeneweis athleteplaysinleague sportsleague mlb,0.4276425838,1
sportsteam milwaukeebucks teamhomestadium stadiumoreventvenue bradleycenter,0.4211134315,1
sportsteam heat teamplaysinleague sportsleague nba,0.4276425838,1
athlete jasonmichaels athleteplaysinleague sportsleague mlb,0.4254615307,1
athlete orlandocabrera athleteplayssport sport baseball,0.4143873155,1
athlete jasonphillips athleteplaysinleague sportsleague mlb,0.4113820195,1
sportsteam st+AF8AXwBf-louiscardinals teamhomestadium stadiumoreventvenue buschmemorialstadium,0.4229846895,1
personmexico ubaldojimenez athleteplaysinleague sportsleague mlb,0.4069062769,1
athlete jimjohnson athleteplaysinleague sportsleague mlb,0.4276425838,1
athlete pedroalvarez athleteplaysinleague sportsleague mlb,0.4003387988,1
athlete gavinfloyd athleteplaysinleague sportsleague mlb,0.4276425838,1
athlete jamesloney athleteplaysinleague sportsleague mlb,0.4276425838,1
athlete vicentepadilla athleteplaysinleague sportsleague mlb,0.4276425838,1
