triple,truth
personmexico melkycabrera athleteplayssport sport baseball,1
athlete chrisbosh athleteplaysforteam sportsteam raptors,0
athlete juliofranco athleteledsportsteam sportsteam redsox,0
athlete joenathan athleteplaysinleague sportsleague mlb,1
sportsteam newyorkjets teamhomestadium stadiumoreventvenue giantsstadium,1
athlete barrybonds athleteledsportsteam sportsteam sanfranciscogiants,1
athlete clameredith athleteplaysinleague sportsleague mlb,1
sportsleague nfl leaguestadiums stadiumoreventvenue heinzfield,1
athlete jeremyhermida athleteplaysinleague sportsleague mlb,1
athlete billmazeroski athleteplayssport sport baseball,1
personeurope jamesmcdonald athleteplayssport sport baseball,1
athlete rafaelsoriano athleteplayssport sport baseball,1
athlete johnsalmons athleteplaysforteam sportsteam kings,0
sportsteam tampabayrays teamhomestadium stadiumoreventvenue tropicanafield,1
athlete davidortiz athleteplaysinleague sportsleague mlb,1
sportsteam colts teamhomestadium stadiumoreventvenue lucasoilstadium,1
sportsteam brazil teamplaysagainstteam sportsteam germany,1
personus royoswalt athleteplaysinleague sportsleague mlb,1
personmexico clintbarmes athleteplaysforteam sportsteam coloradorockies,0
coach joshbeckett athleteplayssport sport baseball,1
sportsleague ncaa leaguestadiums stadiumoreventvenue beaverstadium,1
athlete tywigginton athleteledsportsteam sportsteam houstonastros,1
athlete dicek athleteplayssport sport baseball,1
sportsteam newenglandpatriots teamplaysinleague sportsleague nfl,1
coach jjhardy athleteledsportsteam sportsteam brewers,1
athlete pedroalvarez athleteplayssport sport baseball,1
athlete rafaelbetancourt athleteplayssport sport baseball,1
athlete tysonchandler athleteplaysforteam sportsteam sacramentostatehornets,0
personmexico mattkemp athleteplaysinleague sportsleague mlb,1
athlete edwinjackson athleteplaysinleague sportsleague mlb,1
athlete mikemussina athleteplaysinleague sportsleague mlb,1
personaustralia davidross athleteplayssport sport baseball,1
coach horacioramirez coachesteam sportsteam redsox,0
personmexico jasonbay athleteplayssport sport baseball,1
personmexico bradhawpe athleteplaysforteam sportsteam coloradorockies,0
athlete hidekimatsui athleteplayssport sport baseball,1
athlete kevinslowey athleteplayssport sport baseball,1
athlete jimkelly athleteledsportsteam sportsteam bills,1
athlete dennybautista athleteplaysinleague sportsleague mlb,1
athlete hidekimatsui athleteplaysforteam sportsteam newyorkyankees,1
athlete reggienelson athleteplaysforteam sportsteam magic,0
male alexrios athleteledsportsteam sportsteam bluejays,1
athlete dereklowe athleteplaysinleague sportsleague mlb,1
athlete chadqualls athleteplaysinleague sportsleague mlb,1
athlete philiprivers athleteplaysforteam sportsteam sandiegochargers,1
athlete jakewestbrook athleteplaysinleague sportsleague mlb,1
athlete josereyes athleteplayssport sport baseball,1
athlete scotteyre athleteplayssport sport baseball,1
sportsleague nfl leaguestadiums stadiumoreventvenue edwardjonesdome,1
sportsteam michiganstatespartans teamhomestadium stadiumoreventvenue spartanstadium,1
personmexico ubaldojimenez athleteplayssport sport baseball,1
sportsteam denvernuggets teamplaysinleague sportsleague nba,1
athlete pauloneill athleteplayssport sport baseball,1
coach geoffjenkins athleteplaysinleague sportsleague mlb,1
athlete dougdavis athleteplayssport sport baseball,1
athlete fredlynn athleteplayssport sport baseball,1
athlete ryandempster athleteplaysinleague sportsleague mlb,1
athlete ryanfitzpatrick athleteledsportsteam sportsteam bengals,0
sportsteam goldenstatewarriors teamhomestadium stadiumoreventvenue oraclearena,1
athlete rafaelfurcal athleteplayssport sport baseball,1
athlete blakedewitt athleteplaysinleague sportsleague mlb,1
athlete denardspan athleteplaysinleague sportsleague mlb,1
athlete daveroberts athleteplayssport sport baseball,1
athlete craigbiggio athleteplayssport sport baseball,1
sportsteam arizonadiamondbacks teamplaysinleague sportsleague mlb,1
personmexico markmcgwire athleteplaysforteam sportsteam louiscardinals,1
athlete angelberroa athleteplaysinleague sportsleague mlb,1
sportsleague mlb leaguestadiums stadiumoreventvenue mcafeecoliseum,1
male dondrysdale athleteplaysinleague sportsleague mlb,0
coach changailey worksfor sportsteam georgiatech,0
coach faustocarmona athleteplayssport sport baseball,1
coach josearredondo athleteplayssport sport baseball,1
athlete paulbako athleteplaysinleague sportsleague mlb,1
athlete sidneycrosby athleteplaysforteam sportsteam pittsburghpenguins,1
athlete timtebow athleteplaysforteam sportsteam floridagators,0
personaustralia davidpauley athleteplayssport sport baseball,1
athlete mikelowell athleteplaysforteam sportsteam redsox,1
athlete philsimms athleteplaysforteam sportsteam newyorkgiants,1
athlete joenamath athleteledsportsteam sportsteam newyorkjets,1
athlete hidekiokajima athleteplaysforteam sportsteam newyorkyankees,1
personmexico jasonbay athleteplaysinleague sportsleague mlb,1
athlete tonypena athleteplaysinleague sportsleague mlb,1
athlete curtschilling athleteplaysinleague sportsleague mlb,1
athlete brayanpena athleteplayssport sport baseball,1
sportsleague ncaa leaguestadiums stadiumoreventvenue neylandstadium,1
sportsteam marlins teamhomestadium stadiumoreventvenue dolphinstadium,1
athlete jimleyritz athleteplayssport sport baseball,1
athlete shelleyduncan athleteplaysinleague sportsleague mlb,1
athlete bradbutler athleteplaysforteam sportsteam charlottebobcats,0
athlete scottrolen athleteplayssport sport baseball,1
athlete garycarter athleteplaysinleague sportsleague mlb,1
athlete garycarter athleteplayssport sport baseball,1
athlete jasonisringhausen athleteplaysinleague sportsleague mlb,1
athlete justinhuber athleteplayssport sport baseball,1
athlete clayrapada athleteplaysinleague sportsleague mlb,1
personmexico danuggla athleteplayssport sport baseball,1
athlete vladimirradmanovic athleteledsportsteam sportsteam losangeleslakers,0
athlete georgebrett athleteplaysinleague sportsleague mlb,1
sportsteam newyorkmets teamhomestadium stadiumoreventvenue sheastadium,1
athlete yunieskybetancourt athleteplayssport sport baseball,1
athlete toriihunter athleteplaysinleague sportsleague mlb,1
athlete gaylordperry athleteplaysinleague sportsleague mlb,0
sportsteam oaklandraiders teamplaysinleague sportsleague nfl,1
athlete justinhuber athleteplaysinleague sportsleague mlb,1
athlete toddjones athleteplayssport sport baseball,1
sportsleague ncaa leaguestadiums stadiumoreventvenue bryantdenny,1
athlete alcidesescobar athleteplayssport sport baseball,1
sportsleague nba leaguestadiums stadiumoreventvenue unitedcenter,1
athlete joenathan athleteplayssport sport baseball,1
athlete kevinbrown athleteplaysinleague sportsleague mlb,1
athlete johnnycueto athleteplaysinleague sportsleague mlb,1
athlete paulkonerko athleteplaysinleague sportsleague mlb,1
athlete frankfrancisco athleteplaysforteam sportsteam rangers,0
athlete jaketsakalidis athleteplaysinleague sportsleague mlb,1
athlete mattwieters athleteplaysinleague sportsleague mlb,1
athlete tywigginton athleteplayssport sport baseball,1
coach aaronbrooks athleteplaysforteam sportsteam rockets,1
personmexico carlosbeltran athleteledsportsteam sportsteam newyorkmets,1
sportsleague mlb leaguestadiums stadiumoreventvenue sheastadium,1
athlete morrispeterson athleteplaysforteam sportsteam raptors,1
athlete joeflacco athleteplaysforteam sportsteam baltimorecolts,0
coach markkotsay coachesteam sportsteam atlantabraves,1
athlete hanleyramirez athleteplaysinleague sportsleague mlb,1
sportsteam suns teamplaysinleague sportsleague nba,1
personmexico estebangerman athleteplayssport sport baseball,1
personaustralia derekfisher athleteledsportsteam sportsteam losangeleslakers,1
sportsleague mlb leaguestadiums stadiumoreventvenue tropicanafield,1
sportsleague nfl leaguestadiums stadiumoreventvenue candlestickpark,1
athlete tywigginton athleteplaysinleague sportsleague mlb,1
coach petecarroll worksfor sportsteam usc,1
athlete jeremyhermida athleteplaysforteam sportsteam marlins,0
athlete ericgagne athleteplayssport sport baseball,1
athlete rondellwhite athleteplaysinleague sportsleague mlb,1
athlete felixpie athleteplayssport sport baseball,1
athlete nomargarciaparra athleteplaysforteam sportsteam dodgers,0
athlete homerbailey athleteplayssport sport baseball,1
personmexico johngrabow athleteplayssport sport baseball,1
athlete armandogalarraga athleteplayssport sport baseball,1
athlete yovanigallardo athleteplayssport sport baseball,1
athlete charliebatch athleteplaysforteam sportsteam steelers,0
personmexico miguelcabrera athleteplaysinleague sportsleague mlb,1
sportsteam kansascitychiefs teamplaysinleague sportsleague nfl,1
personmexico clintbarmes athleteledsportsteam sportsteam coloradorockies,0
athlete joshhamilton athleteplayssport sport baseball,1
athlete edwinjackson athleteplayssport sport baseball,1
athlete keiigawa athleteplaysinleague sportsleague mlb,1
athlete ramonortiz athleteplayssport sport baseball,1
athlete jobachamberlain athleteplayssport sport baseball,1
athlete scotthairston athleteplayssport sport baseball,1
athlete tonypena athleteplayssport sport baseball,1
sportsteam titans teamhomestadium stadiumoreventvenue lpfield,1
athlete jakewestbrook athleteplayssport sport baseball,1
sportsteam seattlemariners teamhomestadium stadiumoreventvenue safecofield,1
athlete felixpie athleteplaysinleague sportsleague mlb,1
athlete mikelowell athleteledsportsteam sportsteam redsox,1
athlete aramisramirez athleteplayssport sport baseball,1
sportsteam memphisgrizzlies teamhomestadium stadiumoreventvenue fedexforum,1
athlete hedoturkoglu athleteledsportsteam sportsteam magic,1
athlete kirbypuckett athleteplayssport sport baseball,1
sportsteam titans teamplaysinleague sportsleague nfl,1
athlete nickyoung athleteledsportsteam sportsteam washingtonwizards,0
athlete hunterpence athleteplaysforteam sportsteam houstonastros,0
athlete brianschneider athleteplayssport sport baseball,1
athlete sergioromo athleteplayssport sport baseball,1
athlete elimanning athleteplaysforteam sportsteam newyorkgiants,1
athlete raferalston athleteledsportsteam sportsteam rockets,1
athlete robbiefowler athletehomestadium stadiumoreventvenue anfield,0
athlete mikemussina athleteplayssport sport baseball,1
athlete ajburnett athleteplayssport sport baseball,1
athlete dexterfowler athleteplaysinleague sportsleague mlb,1
athlete garysheffield athleteplaysinleague sportsleague mlb,1
athlete joseguillen athleteplayssport sport baseball,1
coach joseceda athleteplayssport sport baseball,1
athlete jhonnyperalta athleteplayssport sport baseball,1
athlete hidekiokajima athleteplaysinleague sportsleague mlb,1
athlete davidwright athleteledsportsteam sportsteam newyorkmets,1
sportsleague nfl leaguestadiums stadiumoreventvenue soldierfield,1
athlete jeffclement athleteplaysinleague sportsleague mlb,1
athlete carlcrawford athleteplaysforteam sportsteam tampabaydevilrays,1
athlete takashisaito athleteplayssport sport baseball,1
personmexico miguelbatista athleteplayssport sport baseball,1
athlete adambostick athleteplaysinleague sportsleague mlb,1
coach juanencarnacion athleteplaysinleague sportsleague mlb,1
athlete jamesshields athleteplayssport sport baseball,1
athlete jesseorosco athleteplaysinleague sportsleague mlb,1
athlete clayrapada athleteplayssport sport baseball,1
personmexico djmbenga athleteledsportsteam sportsteam coloradorockies,0
athlete edwinencarnacion athleteplaysinleague sportsleague mlb,1
athlete evanlongoria athleteplaysinleague sportsleague mlb,1
sportsleague ncaa leaguestadiums stadiumoreventvenue lanestadium,1
athlete carlcrawford coachesteam sportsteam tampabaydevilrays,1
athlete sambradford athleteledsportsteam sportsteam sooners,1
sportsleague nba leaguestadiums stadiumoreventvenue pepsicenter,1
personmexico scottolsen athleteplayssport sport baseball,1
athlete bretttomko athleteplayssport sport baseball,1
athlete ryanbraun athleteplaysforteam sportsteam brewers,1
coach chuckamato worksfor sportsteam wolfpack,1
athlete paulbako athleteplayssport sport baseball,1
athlete stevetrachsel athleteplayssport sport baseball,1
sportsleague mlb leaguestadiums stadiumoreventvenue progressivefield,1
athlete jessecrain athleteplayssport sport baseball,1
athlete dwyanewade coachesteam sportsteam heat,1
sportsteam michiganstate teamplaysinleague sportsleague ncaa,1
personmexico davidragan athleteplaysinleague sportsleague mlb,1
coach derrickturnbow athleteplaysinleague sportsleague mlb,1
athlete jackierobinson athleteledsportsteam sportsteam brooklyndodgers,1
athlete mattclement athleteplayssport sport baseball,1
athlete mattjoyce athleteplaysinleague sportsleague mlb,1
athlete jacobyellsbury athleteplayssport sport baseball,1
coach changailey coachesteam sportsteam georgiatech,1
athlete randywolf athleteplaysinleague sportsleague mlb,1
athlete jeffkent athleteplaysinleague sportsleague mlb,1
athlete ryandoumit athleteplayssport sport baseball,1
athlete kellyjohnson athleteplaysinleague sportsleague mlb,1
sportsleague nba leaguestadiums stadiumoreventvenue wachoviacenter,1
athlete justinmason athleteplayssport sport baseball,1
sportsleague nba leaguestadiums stadiumoreventvenue staplescenter,1
athlete dontrellewillis athleteplaysinleague sportsleague mlb,1
athlete philrizzuto athleteplayssport sport baseball,1
athlete tracymcgrady athleteplaysforteam sportsteam rockets,1
sportsteam charlottebobcats teamhomestadium stadiumoreventvenue timewarnercableamphitheater,1
athlete melvinmora athleteplayssport sport baseball,1
athlete davidhuff athleteplayssport sport baseball,1
sportsleague nfl leaguestadiums stadiumoreventvenue metrodome,1
personmexico freddysanchez athleteledsportsteam sportsteam pirates,1
athlete ramontroncoso athleteplaysinleague sportsleague mlb,1
athlete estebanloaiza athleteplayssport sport baseball,1
personmexico jefffrancis athleteplayssport sport baseball,1
coach scottproctor athleteplaysinleague sportsleague mlb,1
athlete jeremy athleteledsportsteam sportsteam newyorkgiants,1
sportsteam newyorkyankees teamhomestadium stadiumoreventvenue yankeestadium,1
coach aaronbrooks athleteledsportsteam sportsteam rockets,1
sportsteam pennstatenittanylions teamhomestadium stadiumoreventvenue beaverstadium,1
athlete seanhenn athleteplayssport sport baseball,1
athlete andylaroche athleteplayssport sport baseball,1
sportsteam detroitpistons teamhomestadium stadiumoreventvenue palaceofauburnhills,1
athlete russellmartin athleteplayssport sport baseball,1
athlete johndanks athleteplaysinleague sportsleague mlb,1
athlete justinmason athleteplaysinleague sportsleague mlb,1
personmexico caseykotchman athleteplaysinleague sportsleague mlb,1
athlete mattjoyce athleteplayssport sport baseball,1
coach brianfalkenborg athleteplayssport sport baseball,1
athlete royhalladay athleteplayssport sport baseball,1
athlete kurtwarner athleteledsportsteam sportsteam louiscardinals,0
personmexico melkycabrera athleteplaysforteam sportsteam newyorkyankees,0
athlete timtebow athleteledsportsteam sportsteam floridagators,1
athlete nickmasset athleteplaysinleague sportsleague mlb,1
personmexico josecontreras athleteplaysinleague sportsleague mlb,1
sportsteam newyorkyankees teamplaysinleague sportsleague mlb,1
personmexico danuggla athleteplaysforteam sportsteam marlins,0
personmexico miguelbatista athleteplaysinleague sportsleague mlb,1
coach larryhughes athleteledsportsteam sportsteam chicagobulls,1
athlete kirkhinrich athleteplaysforteam sportsteam chicagobulls,1
athlete tonyromo athleteplaysforteam sportsteam dallascowboys,1
coach chrisvolstad athleteplayssport sport baseball,1
personmexico vladimirguerrero athleteledsportsteam sportsteam anaheimangels,1
athlete kevinslowey athleteplaysinleague sportsleague mlb,1
athlete stephendrew athleteplaysinleague sportsleague mlb,1
sportsleague mlb leaguestadiums stadiumoreventvenue citizenbankpark,1
sportsteam diamondbacks teamhomestadium stadiumoreventvenue chasefield,1
male dondrysdale athleteplayssport sport baseball,1
athlete guillermodiaz athleteledsportsteam sportsteam knicks,0
athlete tonygwynn athleteplaysinleague sportsleague mlb,0
sportsteam clevelandbrowns teamplaysinleague sportsleague nfl,1
personmexico scottkazmir athleteplayssport sport baseball,1
sportsteam sanfrancisco49ers teamplaysinleague sportsleague nfl,1
athlete philcoke athleteplaysinleague sportsleague mlb,1
personmexico freddysanchez athleteplayssport sport baseball,1
athlete hirokikuroda athleteplayssport sport baseball,1
athlete garrettolson athleteplayssport sport baseball,1
athlete senecawallace athleteledsportsteam sportsteam seahawks,1
athlete yorvittorrealba athleteplaysinleague sportsleague mlb,1
personmexico josevalverde athleteplaysinleague sportsleague mlb,1
athlete dirknowitzki athleteplaysforteam sportsteam mavericks,1
athlete kellyshoppach athleteplayssport sport baseball,1
athlete alexeiramirez athleteplaysforteam sportsteam redsox,1
athlete joakimsoria athleteplayssport sport baseball,1
athlete sagerosenfels athleteplaysforteam sportsteam texans,0
sportsteam sandiegochargers teamplaysinleague sportsleague mlb,0
athlete dontrellewillis athleteplayssport sport baseball,1
athlete tylerclippard athleteplaysinleague sportsleague mlb,1
athlete pelfrey athleteplaysforteam sportsteam newyorkmets,1
athlete michaelfinley athleteplaysforteam sportsteam spurs,0
sportsteam n1985chicagobears teamhomestadium stadiumoreventvenue soldierfield,1
personmexico edinsonvolquez athleteplayssport sport baseball,1
athlete tomseaver athleteplaysinleague sportsleague mlb,0
personmexico alfonsosoriano athleteplaysforteam sportsteam chicagocubs,1
athlete ajpierzynski athleteplayssport sport baseball,1
athlete conorjackson athleteplaysforteam sportsteam diamondbacks,0
sportsteam twins teamhomestadium stadiumoreventvenue metrodome,1
athlete johansantana athleteplayssport sport baseball,1
athlete davidprice athleteledsportsteam sportsteam jazz,0
athlete mattflynn athleteplayssport sport baseball,1
athlete andrewmiller athleteledsportsteam sportsteam bucks,1
sportsteam neworleanshornets teamhomestadium stadiumoreventvenue neworleansarena,1
personmexico wandyrodriguez athleteplaysinleague sportsleague mlb,1
athlete chrissnyder athleteplayssport sport baseball,1
athlete joebeimel athleteplayssport sport baseball,1
sportsteam hawks teamhomestadium stadiumoreventvenue philipsarena,1
athlete placidopolanco athleteplayssport sport baseball,1
sportsteam stlouiscardinals teamplaysinleague sportsleague mlb,1
athlete jefffassero athleteplaysinleague sportsleague mlb,1
personmexico hustonstreet athleteplayssport sport baseball,1
personmexico brianbannister athleteplayssport sport baseball,1
athlete joshphelps athleteplayssport sport baseball,1
athlete jongarland athleteplayssport sport baseball,1
athlete luisaparicio athleteplaysinleague sportsleague mlb,1
sportsteam blackhawks teamhomestadium stadiumoreventvenue wrigleyfield,0
athlete peavy athleteplayssport sport baseball,0
athlete pedroia athleteledsportsteam sportsteam redsox,1
athlete brianbuscher athleteplaysinleague sportsleague mlb,1
athlete mattmurton athleteplayssport sport baseball,1
athlete chrissnyder athleteplaysinleague sportsleague mlb,1
sportsteam newyorkgiants teamplaysinleague sportsleague nfl,1
athlete lidstrom athleteplaysforteam sportsteam redwings,1
athlete scottbaker athleteplaysinleague sportsleague mlb,1
athlete williestargell athleteplaysinleague sportsleague mlb,0
personmexico michaelwuertz athleteplaysinleague sportsleague mlb,1
sportsteam utahjazz teamhomestadium stadiumoreventvenue energysolutionsarena,1
coach joshbeckett athleteplaysinleague sportsleague mlb,1
athlete darrencollison athleteledsportsteam sportsteam ucla,0
athlete carsonpalmer athleteplaysforteam sportsteam bengals,0
athlete pudgerodriguez athleteplaysinleague sportsleague mlb,1
athlete blaineboyer athleteplayssport sport baseball,1
personmexico ivanrodriguez athleteplayssport sport baseball,1
sportsteam tennesseevolunteers teamhomestadium stadiumoreventvenue neylandstadium,1
coach brianbruney athleteplayssport sport baseball,1
personmexico clintbarmes athleteplayssport sport baseball,1
athlete blaineboyer athleteplaysinleague sportsleague mlb,1
athlete mattlaporta athleteplaysinleague sportsleague mlb,1
personmexico wandyrodriguez athleteplayssport sport baseball,1
athlete berniewilliams athleteplayssport sport baseball,1
sportsteam stlouiscardinals teamplaysinleague sportsleague mlb,1
athlete kenjijohjima athleteplayssport sport baseball,1
athlete denardspan athleteplayssport sport baseball,1
personmexico lyleoverbay athleteplayssport sport baseball,1
athlete markanderson athleteplaysforteam sportsteam newenglandpatriots,1
athlete bretttomko athleteplaysinleague sportsleague mlb,1
athlete chuckknoblauch athleteplaysinleague sportsleague mlb,1
personasia carlosarroyo athleteplaysforteam sportsteam magic,1
athlete markreynolds athleteledsportsteam sportsteam diamondbacks,1
athlete sidneyponson athleteplayssport sport baseball,1
sportsleague nhl leaguestadiums stadiumoreventvenue verizoncenter,0
athlete markderosa athleteplaysinleague sportsleague mlb,1
athlete rudygay athleteledsportsteam sportsteam memphisgrizzlies,1
sportsteam bengals teamhomestadium stadiumoreventvenue paulbrownstadium,1
athlete alreyes athleteplayssport sport baseball,1
athlete chrischambliss athleteplaysinleague sportsleague mlb,1
athlete mattholliday coachesteam sportsteam coloradorockies,0
sportsteam rockets teamplaysinleague sportsleague nba,1
athlete akinoriiwamura athleteledsportsteam sportsteam tampabaydevilrays,1
sportsleague nfl leaguestadiums stadiumoreventvenue clevelandbrownsstadium,1
personmexico adamlaroche athleteplaysinleague sportsleague mlb,1
athlete shawngreen athleteplaysinleague sportsleague mlb,1
athlete mikeaviles athleteplaysinleague sportsleague mlb,1
personmexico adameverett athleteplaysinleague sportsleague mlb,1
sportsteam sanfranciscogiants teamhomestadium stadiumoreventvenue candlestickpark,1
sportsteam heat teamhomestadium stadiumoreventvenue americanairlinesarena,1
coach kevinkouzmanoff athleteplaysinleague sportsleague mlb,1
personmexico jasonbartlett athleteplayssport sport baseball,1
sportsleague nba leaguestadiums stadiumoreventvenue philipsarena,1
athlete alreyes athleteplaysinleague sportsleague mlb,1
athlete jeffweaver athleteplaysinleague sportsleague mlb,1
athlete chrisyoung athleteplaysinleague sportsleague mlb,1
sportsteam broncos teamhomestadium stadiumoreventvenue invescofield,1
coach richardjefferson athleteledsportsteam sportsteam nets,1
sportsleague nfl leaguestadiums stadiumoreventvenue louisianasuperdome,1
athlete kevincash athleteplayssport sport baseball,1
personmexico brandonphillips athleteplayssport sport baseball,1
athlete kenjijohjima athleteplaysinleague sportsleague mlb,1
personmexico lastingsmilledge athleteplaysforteam sportsteam newyorkmets,1
athlete kerrycollins athleteledsportsteam sportsteam titans,0
coach johnmaine athleteplayssport sport baseball,1
athlete conorjackson athleteledsportsteam sportsteam diamondbacks,1
sportsleague mlb leaguestadiums stadiumoreventvenue yankeestadium,1
athlete cristhianmartinez athleteplayssport sport baseball,1
sportsteam neworleanssaints teamplaysinleague sportsleague nfl,1
athlete ryantheriot athleteplaysinleague sportsleague mlb,1
personasia brettgardner athleteplaysforteam sportsteam chicagocubs,0
athlete andrayblatche athleteledsportsteam sportsteam washingtonwizards,1
athlete bradausmus athleteplayssport sport baseball,1
sportsteam capitals teamhomestadium stadiumoreventvenue verizoncenter,1
athlete brianroberts athleteplaysforteam sportsteam orioles,1
coach mattguerrier athleteplaysinleague sportsleague mlb,1
athlete joemays athleteplayssport sport baseball,1
sportsteam bostonceltics teamhomestadium stadiumoreventvenue tdbanknorthgarden,1
athlete mussina athleteplaysforteam sportsteam newyorkyankees,1
athlete trentedwards athleteplaysforteam sportsteam bills,0
sport baseball sportusesstadium stadiumoreventvenue historicfenwaypark,1
athlete chipperjones athleteledsportsteam sportsteam atlantabraves,1
athlete bradeldred athleteplayssport sport baseball,1
sportsteam pirates teamplaysinleague sportsleague mlb,1
athlete yunelescobar athleteplayssport sport baseball,1
athlete briangiles athleteplayssport sport baseball,1
coach petecarroll coachesteam sportsteam usc,1
athlete kurtbusch athleteplaysforteam sportsteam baltimorecolts,1
sportsleague nfl leaguestadiums stadiumoreventvenue lambeaufield,1
personmexico clintbarmes athleteplaysinleague sportsleague mlb,1
athlete juliofranco athleteplaysinleague sportsleague mlb,1
athlete wilsonchandler athleteledsportsteam sportsteam knicks,0
athlete philhughes athleteplaysinleague sportsleague mlb,1
personmexico chrissampson athleteplayssport sport baseball,1
personmexico marianorivera athleteplaysinleague sportsleague mlb,1
athlete stevecarlton athleteplaysinleague sportsleague mlb,0
personmexico jameswhite athleteledsportsteam sportsteam chicagobulls,0
athlete jimrice athleteledsportsteam sportsteam bostonred,1
athlete bradradke athleteplaysinleague sportsleague mlb,1
athlete dirknowitzki athleteledsportsteam sportsteam mavericks,1
athlete chaseungbaek athleteplaysinleague sportsleague mlb,1
sportsteam steelers teamhomestadium stadiumoreventvenue heinzfield,1
athlete roycering athleteplayssport sport baseball,1
sportsleague nfl leaguestadiums stadiumoreventvenue gillettestadium,1
athlete patneshek athleteplaysinleague sportsleague mlb,1
athlete trentgreen athleteledsportsteam sportsteam rams,1
athlete claudiovargas athleteplaysinleague sportsleague mlb,1
sportsleague mlb leaguestadiums stadiumoreventvenue turnerfield,1
athlete joedimaggio athleteplaysinleague sportsleague mlb,0
sportsteam auburntigers teamplaysinleague sportsleague ncaa,1
sportsleague nba leaguestadiums stadiumoreventvenue neworleansarena,1
