triple,truth
sportsleague mlb leaguestadiums stadiumoreventvenue dodgerstadium,1
athlete linaskleiza athleteplaysforteam sportsteam nuggets,1
sportsleague nba leaguestadiums stadiumoreventvenue rosegardenarena,1
athlete jasonphillips athleteplayssport sport baseball,1
athlete nady athleteledsportsteam sportsteam newyorkyankees,1
coach mattguerrier athleteplayssport sport baseball,1
athlete oscarvillarreal athleteplayssport sport baseball,1
personmexico vladimirguerrero athleteplaysforteam sportsteam anaheimangels,1
athlete jeffkarstens athleteplaysinleague sportsleague mlb,1
athlete johansantana athleteplaysinleague sportsleague mlb,1
athlete gaylordperry athleteplayssport sport baseball,1
sportsleague nfl leaguestadiums stadiumoreventvenue cowboysstadium,1
athlete samardosamuels athleteledsportsteam sportsteam louiscardinals,1
athlete dmitriyoung athleteplayssport sport baseball,1
athlete briangiles athleteledsportsteam sportsteam sandiegochargers,1
sportsteam redskins teamplaysinleague sportsleague nfl,1
athlete mikecameron athleteplaysinleague sportsleague mlb,1
athlete jeremyhermida athleteledsportsteam sportsteam marlins,1
athlete josereyes athleteledsportsteam sportsteam newyorkmets,1
sportsteam clippers teamplaysinleague sportsleague nba,1
athlete bradpenny athleteplayssport sport baseball,1
sportsteam rams teamhomestadium stadiumoreventvenue edwardjonesdome,1
personmexico gregbiffle athleteplaysforteam sportsteam dodgers,1
athlete mikecameron athleteplaysforteam sportsteam brewers,1
sportsteam losangeleslakers teamplaysinleague sportsleague nba,1
coach ryanspilborghs athleteplayssport sport baseball,1
athlete princefielder athleteplayssport sport baseball,1
personmexico toddcoffey athleteplaysinleague sportsleague mlb,1
coach kevinyoukilis athleteplayssport sport baseball,1
athlete seanhenn athleteplaysinleague sportsleague mlb,1
athlete derosa athleteplaysforteam sportsteam chicagocubs,1
athlete brianbass athleteplayssport sport baseball,1
athlete markteixeira athleteplaysinleague sportsleague mlb,1
athlete kipwells athleteplayssport sport baseball,1
sportsleague ncaa leaguestadiums stadiumoreventvenue rossadestadium,1
athlete joedimaggio athleteplayssport sport baseball,1
athlete andysonnanstine athleteplayssport sport baseball,1
athlete alanembree athleteplaysinleague sportsleague mlb,1
athlete rickvandenhurk athleteplayssport sport baseball,1
coach joeborowski athleteplaysinleague sportsleague mlb,1
personmexico coreyhart athleteplaysinleague sportsleague mlb,1
male alexrios athleteplayssport sport baseball,1
coach jeffsamardzija athleteplayssport sport baseball,1
athlete clameredith athleteplayssport sport baseball,1
athlete jameycarroll athleteplayssport sport baseball,1
athlete ericgordon athleteledsportsteam sportsteam clippers,1
personmexico mickeycochrane athleteplayssport sport baseball,1
athlete joemorgan athleteplaysinleague sportsleague mlb,1
sportsteam alabamacrimsontide teamhomestadium stadiumoreventvenue bryantdenny,1
athlete jongarland athleteplaysinleague sportsleague mlb,1
athlete philnevin athleteplaysinleague sportsleague mlb,1
sportsteam losangeleslakers teamhomestadium stadiumoreventvenue staplescenter,1
athlete mattryan athleteledsportsteam sportsteam bostoncollege,1
athlete amarestoudemire athleteplaysforteam sportsteam suns,1
athlete jimrice athleteplayssport sport baseball,1
athlete philhughes athleteplayssport sport baseball,1
athlete ronnycedeno athleteplayssport sport baseball,1
athlete pedromartinez athleteplayssport sport baseball,1
athlete andreabargnani athleteplaysforteam sportsteam raptors,1
athlete goosegossage athleteplayssport sport baseball,1
personmexico ryanchurch athleteplaysforteam sportsteam newyorkmets,1
athlete otisnixon athleteplayssport sport baseball,1
coach horacioramirez athleteplaysinleague sportsleague mlb,1
coach derrickturnbow athleteplayssport sport baseball,1
personmexico adamlaroche athleteplayssport sport baseball,1
sportsleague nba leaguestadiums stadiumoreventvenue timewarnercableamphitheater,0
athlete evanmeek athleteplaysinleague sportsleague mlb,1
athlete joeblanton athleteplaysinleague sportsleague mlb,1
coach sethsmith athleteplaysinleague sportsleague mlb,1
sportsteam magic teamhomestadium stadiumoreventvenue amwayarena,1
athlete vladimirradmanovic athleteplaysforteam sportsteam losangeleslakers,1
athlete justinmorneau athleteledsportsteam sportsteam twins,1
athlete jalenrose athleteplaysinleague sportsleague mlb,1
athlete patneshek athleteplayssport sport baseball,1
athlete hidekiokajima athleteledsportsteam sportsteam newyorkyankees,1
coach josejuanbarea athleteledsportsteam sportsteam cavaliers,1
athlete dustinpedroia athleteplaysinleague sportsleague mlb,1
athlete mattflynn athleteplaysinleague sportsleague mlb,0
sportsteam bills teamplaysinleague sportsleague nfl,1
athlete carsonpalmer athletehomestadium stadiumoreventvenue paulbrownstadium,1
sportsleague nba leaguestadiums stadiumoreventvenue tdbanknorthgarden,1
athlete jimleyritz athleteplaysinleague sportsleague mlb,1
athlete cococrisp athleteplaysinleague sportsleague mlb,1
personmexico khalilgreene athleteledsportsteam sportsteam sandiegochargers,0
personmexico adriangonzalez athleteplaysinleague sportsleague mlb,1
athlete rajonrondo athleteledsportsteam sportsteam bostonceltics,1
athlete jasonmotte athleteplaysinleague sportsleague mlb,1
athlete philiprivers athleteledsportsteam sportsteam sandiegochargers,1
athlete movaughn athleteplaysinleague sportsleague mlb,1
athlete randyjohnson athleteplaysinleague sportsleague mlb,1
coach horacioramirez worksfor sportsteam redsox,1
athlete danfouts athleteplaysforteam sportsteam sandiegochargers,1
athlete nolanryan athleteplayssport sport baseball,1
athlete noahlowry athleteledsportsteam sportsteam n1985chicagobears,0
personmexico mattdiaz athleteplayssport sport baseball,1
personmexico raulvaldes athleteplayssport sport baseball,1
athlete shaq athleteledsportsteam sportsteam suns,1
athlete raferalston athleteplaysforteam sportsteam rockets,1
coach paulbyrd athleteplaysinleague sportsleague mlb,1
personmexico mattkemp athleteplayssport sport baseball,1
athlete kevinbrown athleteplayssport sport baseball,1
sportsteam clevelandbrowns teamhomestadium stadiumoreventvenue clevelandbrownsstadium,1
athlete micahowings athleteplaysinleague sportsleague mlb,1
athlete alantrammell athleteplayssport sport baseball,1
personmexico caseykotchman athleteplayssport sport baseball,1
athlete justinverlander athleteplaysinleague sportsleague mlb,1
athlete jesselitsch athleteplaysinleague sportsleague mlb,1
personmexico jorgeposada athleteplaysinleague sportsleague mlb,1
sportsteam knicks teamplaysinleague sportsleague nba,1
athlete mikegonzalez athleteplayssport sport baseball,1
sportsteam clevelandindians teamplaysinleague sportsleague mlb,1
athlete cococrisp athleteplayssport sport baseball,1
athlete stevecarlton athleteplayssport sport baseball,1
coach mikemacdougal athleteplaysinleague sportsleague mlb,1
athlete trentedwards athleteledsportsteam sportsteam bills,1
sportsleague mlb leaguestadiums stadiumoreventvenue petcopark,1
athlete zackgreinke athleteplaysinleague sportsleague mlb,1
athlete adrianbeltre athleteledsportsteam sportsteam seattlemariners,1
athlete scotthairston athleteplaysinleague sportsleague mlb,1
personmexico franciscogarcia athleteplayssport sport baseball,1
athlete carlospena athleteledsportsteam sportsteam tampabaydevilrays,1
athlete bjupton athleteplaysinleague sportsleague mlb,1
athlete adrianbeltre athleteplaysforteam sportsteam seattlemariners,1
athlete ccsabathia athleteplaysinleague sportsleague mlb,1
athlete rajonrondo athleteplaysforteam sportsteam bostonceltics,1
athlete sergioromo athleteplaysinleague sportsleague mlb,1
personmexico morganensberg athleteplayssport sport baseball,1
personmexico jameswhite athletehomestadium stadiumoreventvenue unitedcenter,1
personmexico luiscastillo athleteplaysinleague sportsleague mlb,1
personmexico carlosbeltran athleteplaysforteam sportsteam newyorkmets,1
athlete kirkhinrich athleteledsportsteam sportsteam chicagobulls,1
coach briansanches athleteplayssport sport baseball,1
coach brianbruney athleteplaysinleague sportsleague mlb,1
personmexico gregbiffle athleteledsportsteam sportsteam dodgers,1
personmexico vernonwells athleteledsportsteam sportsteam bluejays,1
personmexico joeinglett athleteplaysinleague sportsleague mlb,1
sportsteam tampabayrays teamplaysinleague sportsleague mlb,1
athlete rossgload athleteplayssport sport baseball,1
athlete eddiemathews athleteplayssport sport baseball,1
athlete noahlowry athleteplaysforteam sportsteam n1985chicagobears,0
athlete mattwilliams athleteplaysinleague sportsleague mlb,1
athlete santiagocasilla athleteplaysinleague sportsleague mlb,1
athlete paulmaholm athleteplaysinleague sportsleague mlb,1
athlete hakimwarrick athleteledsportsteam sportsteam reds,0
athlete kevinmillar athleteplaysinleague sportsleague mlb,1
athlete davidortiz athleteplaysforteam sportsteam redsox,1
coach joseceda athleteplaysinleague sportsleague mlb,1
athlete estebanloaiza athleteplaysinleague sportsleague mlb,1
coach horacioramirez athleteledsportsteam sportsteam redsox,1
athlete xaviernady athleteledsportsteam sportsteam newyorkyankees,1
athlete davidortiz athleteplayssport sport baseball,1
personmexico carlosbeltran athleteplayssport sport baseball,1
personmexico michaelbarrett athleteplayssport sport baseball,1
athlete adambostick athleteplayssport sport baseball,1
personmexico danuggla athleteledsportsteam sportsteam marlins,1
personmexico nickpunto athleteplayssport sport baseball,1
athlete luisvalbuena athleteplayssport sport baseball,1
personmexico jasonfrasor athleteplayssport sport baseball,1
athlete jaketsakalidis athleteplayssport sport baseball,0
athlete jeffkent athleteplaysforteam sportsteam dodgers,1
sportsteam wisconsinbadgers teamhomestadium stadiumoreventvenue camprandallstadium,1
athlete jimjohnson athleteplayssport sport baseball,1
athlete davidprice athleteplaysforteam sportsteam jazz,0
athlete markbuehrle athleteplaysinleague sportsleague mlb,1
personmexico jackmorris athleteplaysinleague sportsleague mlb,1
personmexico shanevictorino athleteplayssport sport baseball,1
athlete jeffnelson athleteplayssport sport baseball,1
athlete kengriffeyjr athleteledsportsteam sportsteam reds,1
personmexico brianbannister athleteplaysinleague sportsleague mlb,1
personmexico chrisiannetta athleteplaysinleague sportsleague mlb,1
athlete mikerabelo athleteplayssport sport baseball,1
athlete honuswagner athleteplaysinleague sportsleague mlb,1
sportsleague mlb leaguestadiums stadiumoreventvenue jacobsfield,1
athlete mikerabelo athleteplaysinleague sportsleague mlb,1
athlete cjwilson athleteplaysinleague sportsleague mlb,1
athlete timredding athleteplaysinleague sportsleague mlb,1
athlete dexterfowler athleteplayssport sport baseball,1
athlete samardosamuels athleteplaysforteam sportsteam louiscardinals,0
athlete otisnixon athleteplaysinleague sportsleague mlb,1
personmexico nickpunto athleteledsportsteam sportsteam twins,1
athlete kosukefukudome athleteplayssport sport baseball,1
athlete baberuth athleteplaysforteam sportsteam newyorkyankees,0
athlete chadqualls athleteplayssport sport baseball,1
athlete jaysonwerth athleteplaysinleague sportsleague mlb,1
personmexico jameswhite athleteplaysforteam sportsteam chicagobulls,1
personafrica troysmith athleteplaysforteam sportsteam baltimorecolts,0
athlete andruwjones athleteplaysinleague sportsleague mlb,1
coach scottschoeneweis athleteplaysinleague sportsleague mlb,1
sportsteam milwaukeebucks teamhomestadium stadiumoreventvenue bradleycenter,1
sportsteam heat teamplaysinleague sportsleague nba,1
athlete jasonmichaels athleteplaysinleague sportsleague mlb,1
athlete orlandocabrera athleteplayssport sport baseball,1
athlete jasonphillips athleteplaysinleague sportsleague mlb,1
sportsteam stlouiscardinals teamhomestadium stadiumoreventvenue buschmemorialstadium,1
personmexico ubaldojimenez athleteplaysinleague sportsleague mlb,1
athlete jimjohnson athleteplaysinleague sportsleague mlb,1
athlete pedroalvarez athleteplaysinleague sportsleague mlb,1
athlete gavinfloyd athleteplaysinleague sportsleague mlb,1
athlete jamesloney athleteplaysinleague sportsleague mlb,1
athlete vicentepadilla athleteplaysinleague sportsleague mlb,1
athlete tonysipp athleteplaysinleague sportsleague mlb,1
personmexico colehamels athleteplayssport sport baseball,1
sportsteam atlantahawks teamplaysinleague sportsleague nba,1
athlete jasoncampbell athleteplaysforteam sportsteam redskins,1
athlete woodywilliams athleteplaysinleague sportsleague mlb,1
personmexico franciscogarcia athleteplaysinleague sportsleague mlb,1
personmexico davidragan athleteplayssport sport baseball,0
sportsteam torontobluejays teamhomestadium stadiumoreventvenue rogerscentre,1
athlete damonhuard athleteledsportsteam sportsteam kansascitychiefs,1
sportsteam milwaukeebrewers teamplaysinleague sportsleague mlb,1
athlete dennybautista athleteplayssport sport baseball,1
athlete brettfavre athleteplaysforteam sportsteam newyorkjets,0
athlete akinoriiwamura athleteplaysinleague sportsleague mlb,1
athlete garysheffield athleteplayssport sport baseball,1
athlete vinceyoung athleteplaysforteam sportsteam titans,1
athlete michaelcuddyer athleteplayssport sport baseball,1
personmexico curtisgranderson athleteplayssport sport baseball,1
athlete nickswisher athleteplaysinleague sportsleague mlb,1
athlete timwakefield athleteplaysinleague sportsleague mlb,1
athlete xaviernady athleteplayssport sport baseball,1
personmexico jorgesosa athleteplayssport sport baseball,1
personmexico joeinglett athleteplayssport sport baseball,1
sportsteam utahjazz teamplaysinleague sportsleague nba,1
coach kevinyoukilis athleteplaysforteam sportsteam redsox,1
sportsleague nba leaguestadiums stadiumoreventvenue bradleycenter,1
athlete jasonisringhausen athleteplayssport sport baseball,1
sportsleague mlb leaguestadiums stadiumoreventvenue coorsfield,1
athlete carlospena athleteplaysforteam sportsteam tampabaydevilrays,1
personmexico chienmingwang athleteplaysinleague sportsleague mlb,1
sportsteam denvernuggets teamhomestadium stadiumoreventvenue pepsicenter,1
athlete sergiomitre athleteplaysinleague sportsleague mlb,1
athlete bradausmus athleteplaysinleague sportsleague mlb,1
athlete frankrobinson athleteplaysinleague sportsleague mlb,1
athlete ryanfreel athleteplaysforteam sportsteam reds,1
personmexico ericdickerson athleteplaysforteam sportsteam louiscardinals,0
athlete wadeboggs athleteplayssport sport baseball,1
athlete mattryan athleteplaysforteam sportsteam bostoncollege,1
personmexico jefffrancis athleteplaysinleague sportsleague mlb,1
athlete mattlindstrom athleteplayssport sport baseball,1
athlete jparencibia athleteledsportsteam sportsteam bills,0
personafrica troysmith athleteledsportsteam sportsteam baltimorecolts,0
athlete juliofranco athleteplaysforteam sportsteam redsox,0
athlete davidherndon athleteplaysinleague sportsleague mlb,1
sportsteam minnesotavikings teamplaysinleague sportsleague nfl,1
athlete jrrussell athleteplaysforteam sportsteam oaklandraiders,0
personmexico mattcapps athleteplaysinleague sportsleague mlb,1
athlete dwyanewade athleteledsportsteam sportsteam heat,1
athlete koyiehill athleteplayssport sport baseball,1
athlete chaddurbin athleteplaysinleague sportsleague mlb,1
personmexico curtisgranderson athleteplaysinleague sportsleague mlb,1
personmexico alfonsosoriano athleteplayssport sport baseball,1
personmexico johnnydamon athleteplaysinleague sportsleague mlb,1
personus kobebryant athleteplaysforteam sportsteam losangeleslakers,1
athlete robinventura athleteplaysinleague sportsleague mlb,1
athlete thome athleteplaysinleague sportsleague mlb,1
athlete dustinpedroia athleteledsportsteam sportsteam redsox,1
personmexico joeygathright athleteplayssport sport baseball,1
athlete davidherndon athleteplayssport sport baseball,1
athlete brianroberts athleteplayssport sport baseball,1
athlete bjupton athleteplayssport sport baseball,1
personmexico vernonwells athleteplaysforteam sportsteam bluejays,1
athlete ichirosuzuki athleteplaysforteam sportsteam seattlemariners,1
sportsteam ducks teamhomestadium stadiumoreventvenue hondacenter,1
personmexico jorgeposada athleteplayssport sport baseball,1
athlete nickmasset athleteplayssport sport baseball,1
athlete tomseaver athleteplayssport sport baseball,1
sportsleague mlb leaguestadiums stadiumoreventvenue greatamericanballpark,1
athlete santiagocasilla athleteplayssport sport baseball,1
athlete rossgload athleteplaysinleague sportsleague mlb,1
personmexico khalilgreene athleteplaysforteam sportsteam sandiegochargers,0
sportsteam liverpool teamhomestadium stadiumoreventvenue anfield,1
athlete bartstarr athleteledsportsteam sportsteam packers,1
athlete ajburnett athleteplaysinleague sportsleague mlb,1
athlete juanpie athleteplaysforteam sportsteam marlins,1
sportsteam charlottebobcats teamplaysinleague sportsleague nba,1
athlete jojoreyes athleteplayssport sport baseball,1
athlete rondellwhite athleteplayssport sport baseball,1
athlete briangiles athleteplaysinleague sportsleague mlb,1
athlete carlospena athleteplaysinleague sportsleague mlb,1
athlete josecalderon athleteledsportsteam sportsteam raptors,0
sportsteam detroittigers teamhomestadium stadiumoreventvenue comerica,1
athlete davidjustice athleteplayssport sport baseball,1
athlete richardhamilton athleteplaysforteam sportsteam fortwaynepistons,0
athlete migueltejada athleteplaysforteam sportsteam houstonastros,0
athlete josereyes athleteplaysforteam sportsteam newyorkmets,0
athlete morrispeterson athleteledsportsteam sportsteam raptors,1
personmexico ericdickerson athleteledsportsteam sportsteam louiscardinals,0
personmexico bradhawpe athleteplayssport sport baseball,1
athlete andruwjones athleteplayssport sport baseball,1
coach randorbierd athleteplayssport sport baseball,1
athlete favre athleteledsportsteam sportsteam newyorkjets,1
personmexico melkycabrera athleteledsportsteam sportsteam newyorkyankees,0
athlete michaelcuddyer athleteplaysinleague sportsleague mlb,1
sportsteam sacramentokings teamplaysinleague sportsleague nba,1
athlete johansantana athleteledsportsteam sportsteam newyorkmets,1
athlete bosh athleteledsportsteam sportsteam raptors,1
athlete mattlawton athleteplaysinleague sportsleague mlb,1
athlete sergiomitre athleteplayssport sport baseball,1
athlete ryanshealy athleteplaysinleague sportsleague mlb,1
athlete jaysonwerth athleteplayssport sport baseball,1
personmexico lukescott athleteplaysinleague sportsleague mlb,1
athlete brianschneider athleteplaysinleague sportsleague mlb,1
athlete montaellis athleteledsportsteam sportsteam goldenstatewarriors,1
coach tonydungy coachesteam sportsteam colts,1
athlete migueltejada athleteledsportsteam sportsteam houstonastros,0
athlete dougdavis athleteplaysinleague sportsleague mlb,1
athlete jamesshields athleteplaysinleague sportsleague mlb,1
coach jjhardy athleteplaysforteam sportsteam brewers,0
sportsteam redwings teamhomestadium stadiumoreventvenue joelouisarena,1
athlete kerrywood athleteplaysinleague sportsleague mlb,1
athlete andrayblatche athleteplaysforteam sportsteam washingtonwizards,0
athlete hunterpence athleteplayssport sport baseball,1
personmexico javierlopez athleteplaysinleague sportsleague mlb,1
athlete daveroberts athleteplaysinleague sportsleague mlb,1
sportsteam colts teamplaysinleague sportsleague nfl,1
athlete davidjustice athleteledsportsteam sportsteam atlantabraves,1
personmexico lastingsmilledge athleteplayssport sport baseball,1
athlete dustinackley athleteplayssport sport baseball,1
sportsteam pittsburghpenguins teamhomestadium stadiumoreventvenue mellonarena,1
coach faustocarmona athleteplaysinleague sportsleague mlb,1
sportsteam reds teamhomestadium stadiumoreventvenue greatamericanballpark,1
athlete bradeldred athleteplaysinleague sportsleague mlb,1
sportsteam lsu teamhomestadium stadiumoreventvenue tigerstadium,1
athlete freddygarcia athleteplayssport sport baseball,1
athlete timwakefield athleteplayssport sport baseball,1
sportsteam tampabaydevilrays teamplaysinleague sportsleague mlb,1
athlete chriswebber athleteplaysforteam sportsteam sixers,0
athlete benroethlisberger athleteledsportsteam sportsteam steelers,1
personasia brettgardner athleteplaysinleague sportsleague mlb,1
athlete jairjurrjens athleteplayssport sport baseball,1
personmexico mickeycochrane athleteplaysinleague sportsleague mlb,1
personmexico djmbenga worksfor sportsteam akron,0
sport baseball sportusesstadium stadiumoreventvenue yankeestadium,1
sportsteam michiganstate teamhomestadium stadiumoreventvenue spartanstadium,1
athlete magglioordonez athleteplayssport sport baseball,1
athlete favre athleteplaysforteam sportsteam newyorkjets,1
athlete chrisresop athleteplayssport sport baseball,1
athlete damon athleteledsportsteam sportsteam newyorkyankees,0
sportsteam minnesotatimberwolves teamplaysinleague sportsleague nba,1
sportsteam portlandtrailblazers teamplaysinleague sportsleague nba,1
personmexico boofbonser athleteplayssport sport baseball,1
athlete matthasselbeck athleteplaysforteam sportsteam seahawks,1
sportsteam raptors teamplaysinleague sportsleague nba,1
athlete anibalsanchez athleteplayssport sport baseball,1
athlete tylerclippard athleteplayssport sport baseball,1
male alexrios athleteplaysinleague sportsleague mlb,1
athlete seanburnett athleteplayssport sport baseball,1
sportsteam pennstatenittanylions teamplaysinleague sportsleague ncaa,1
personmexico ivanrodriguez athleteplaysinleague sportsleague mlb,1
athlete chrissmith athleteplayssport sport baseball,1
athlete ramonhernandez athleteplayssport sport baseball,1
personasia juancruz athleteplaysforteam sportsteam newyorkyankees,0
athlete dereklowe athleteplayssport sport baseball,1
personmexico carlosbeltran athleteplaysinleague sportsleague mlb,1
personaustralia davidross athleteplaysinleague sportsleague mlb,1
athlete bradyquinn athleteplaysforteam sportsteam clevelandbrowns,1
sportsleague nfl leaguestadiums stadiumoreventvenue fedexfield,1
athlete joshphelps athleteplaysinleague sportsleague mlb,1
athlete udonishaslem athleteledsportsteam sportsteam heat,1
athlete pelfrey athleteledsportsteam sportsteam newyorkmets,1
personmexico jasonkubel athleteplaysinleague sportsleague mlb,1
personmexico odalisperez athleteplaysinleague sportsleague mlb,1
athlete baberuth athleteledsportsteam sportsteam newyorkyankees,1
athlete kevingregg athleteplayssport sport baseball,1
coach jimharbaugh coachesteam sportsteam stanford,0
sportsteam dallascowboys teamhomestadium stadiumoreventvenue cowboysstadium,1
personmexico joelzumaya athleteplayssport sport baseball,1
athlete vicentepadilla athleteplayssport sport baseball,1
athlete joemorgan athleteplayssport sport baseball,1
athlete amarestoudemire athleteledsportsteam sportsteam suns,1
personmexico jasonbay athleteplaysforteam sportsteam pirates,1
athlete brettmyers athleteplaysinleague sportsleague mlb,1
athlete georgesherrill athleteplaysinleague sportsleague mlb,1
personmexico hongchihkuo athleteplayssport sport baseball,1
personaustralia derekfisher athleteplaysforteam sportsteam losangeleslakers,1
athlete harmonkillebrew athleteplayssport sport baseball,1
personmexico johngrabow athleteplaysinleague sportsleague mlb,1
personmexico joshwillingham athleteplayssport sport baseball,1
personmexico alfonsosoriano coachesteam sportsteam chicagocubs,0
athlete royhalladay athleteplaysinleague sportsleague mlb,1
athlete dmitriyoung athleteplaysinleague sportsleague mlb,1
coach mikemacdougal athleteplayssport sport baseball,1
athlete lukewalton athleteledsportsteam sportsteam losangeleslakers,1
personmexico jasonbay athleteledsportsteam sportsteam pirates,1
athlete matttreanor athleteplayssport sport baseball,1
athlete eddiemathews athleteplaysinleague sportsleague mlb,1
athlete cococrisp athleteledsportsteam sportsteam redsox,1
personmexico bradhawpe athleteledsportsteam sportsteam coloradorockies,1
sportsteam losangelesclippers teamplaysinleague sportsleague nba,1
athlete robinventura athleteplayssport sport baseball,1
personmexico carlpavano athleteplayssport sport baseball,1
athlete cococrisp athleteledsportsteam sportsteam redsox,1
athlete nomargarciaparra athleteledsportsteam sportsteam dodgers,1
athlete nady athleteplaysforteam sportsteam newyorkyankees,1
athlete luisayala athleteplaysinleague sportsleague mlb,1
sportsleague nba leaguestadiums stadiumoreventvenue arcoarena,1
sportsteam hawks teamplaysinleague sportsleague nba,1
athlete hankaaron athleteplaysinleague sportsleague mlb,0
personmexico shanevictorino athleteledsportsteam sportsteam phillies,1
athlete chaseutley athletehomestadium stadiumoreventvenue amwayarena,0
athlete walterpayton athleteplaysforteam sportsteam broncos,0
sportsteam suns teamhomestadium stadiumoreventvenue usairwayscenter,1
personmexico adamloewen athleteplayssport sport baseball,1
athlete bosh athleteplaysforteam sportsteam raptors,0
athlete courtneyfells athleteledsportsteam sportsteam wolfpack,1
athlete mattlindstrom athleteplaysinleague sportsleague mlb,1
personmexico dennisrodman athleteplaysinleague sportsleague mlb,0
athlete adamrussell athleteplaysinleague sportsleague mlb,1
personus royoswalt athleteplayssport sport baseball,1
male dye athleteledsportsteam sportsteam redsox,0
athlete damioneasley athleteplayssport sport baseball,1
sportsleague nba leaguestadiums stadiumoreventvenue targetcenter,1
personmexico hustonstreet athleteplaysinleague sportsleague mlb,1
sportsteam pirates teamhomestadium stadiumoreventvenue pncpark,1
personmexico jasonschmidt athleteplaysinleague sportsleague mlb,1
athlete goosegossage athleteplaysinleague sportsleague mlb,1
athlete mikelowell athleteplaysinleague sportsleague mlb,1
personmexico jorgecampillo athleteplaysinleague sportsleague mlb,1
athlete mattholliday athleteplayssport sport baseball,1
